Title,Directions,Quantity,Unit01,Ingredient01,Quantity02,Unit02,Ingredient02,Quantity03,Unit03,Ingredient03,Quantity04,Unit04,Ingredient04,Quantity05,Unit05,Ingredient05,Quantity06,Unit06,Ingredient06,Quantity07,Unit07,Ingredient07,Quantity08,Unit08,Ingredient08,Quantity09,Unit09,Ingredient09,Quantity10,Unit10,Ingredient10,Quantity11,Unit11,Ingredient11,Quantity12,Unit12,Ingredient12,Quantity13,Unit13,Ingredient13,Quantity14,Unit14,Ingredient14,Quantity15,Unit15,Ingredient15,Quantity16,Unit16,Ingredient16,Quantity17,Unit17,Ingredient17,Quantity18,Unit18,Ingredient18,Quantity19,Unit19,Ingredient19,Category,ingredients,tokenized_ingr,ingr_json
Golden Nugget Beef,"Peel oranges, remove outer membrance. Cut into 4 slices per orange, cut slices in half. Place in bowl, mix sugar and soy sauce. Pour over oranges. Let stand 15 minutes. Stir occasionally. Set aside. Combine cornstarch, ginger and pepper. Blend in boullion and water. Stir until smooth. Set aside. Cut flank diagonally into very thin slices. Heat 1 tbsp of oil in large skillet on high heat. Cook half of the meat at a time, just until it looses red color. Use second tbsp of oil with second half of meat. Remove meat from skillet, saute garlic and onion and celery just until transparent, return meat, stir. Add cornstarch mixture. Cook for 30 seconds, stirring constantly. Add oranges and marinade. Cook 10 seconds, serve over mounds of steamed rice.",3,large,oranges,1,tsp,sugar,2,tbsp,soy sauce,1,tbsp,cornstarch, 1/2,tsp,ginger, 1/2,tsp,pepper, 1/2,cup,unsalted beef boullion, 1/4,cup,water,1,lb,flank steak,2,tbsp,vegetable oil,1,clove,minced garlic,1,med,onion,1 1/3,cup,celery,nan,nan,rice,nan,nan,nan,nan,nan,nan,nan,nan,nan,nan,nan,nan,nan,nan,nan,asian food,oranges;sugar;soy sauce;cornstarch;ginger;pepper;unsalted beef boullion;water;flank steak;vegetable oil;minced garlic;onion;celery;rice;nan;nan;nan;nan;nan,"['oranges', ';', 'sugar', ';', 'soy', 'sauce', ';', 'cornstarch', ';', 'ginger', ';', 'pepper', ';', 'unsalted', 'beef', 'boullion', ';', 'water', ';', 'flank', 'steak', ';', 'vegetable', 'oil', ';', 'minced', 'garlic', ';', 'onion', ';', 'celery', ';', 'rice', ';', 'nan', ';', 'nan', ';', 'nan', ';', 'nan', ';', 'nan']",['sugar']
Baby Back Ribs,"Bake 325 degrees for 2 hours. Cover with foil. Grill for 30 minute, basting with sauce every 10 minutes.",nan,nan,Ribs,nan,nan,barbeque sauce,nan,nan,nan,nan,nan,nan,nan,nan,nan,nan,nan,nan,nan,nan,nan,nan,nan,nan,nan,nan,nan,nan,nan,nan,nan,nan,nan,nan,nan,nan,nan,nan,nan,nan,nan,nan,nan,nan,nan,nan,nan,nan,nan,nan,nan,nan,nan,nan,nan,nan,nan,asian food,Ribs;barbeque sauce;nan;nan;nan;nan;nan;nan;nan;nan;nan;nan;nan;nan;nan;nan;nan;nan;nan,"['Ribs', ';', 'barbeque', 'sauce', ';', 'nan', ';', 'nan', ';', 'nan', ';', 'nan', ';', 'nan', ';', 'nan', ';', 'nan', ';', 'nan', ';', 'nan', ';', 'nan', ';', 'nan', ';', 'nan', ';', 'nan', ';', 'nan', ';', 'nan', ';', 'nan', ';', 'nan']",[]
Sweet and Sour Meatballs,Shape into balls. Roll in flour and brown in hot oil. Bring to boil. Pour over meat. Cook for 30 minutes.,1 1/2,lbs,hamburger, 1/2,lb,sausage,1,tsp,accent, 3/4,tsp,salt,1,tbsp,chopped onion, 1/2,cup,bread crumbs, 1/2,cup,milk,2,tbsp,cornstarch,2,tbsp,sugar,1,cup,pineapple juice,1,can,pineapple chunks,1,cube,boullion, 1/2,cup,water, 1/2,cup,vinegar,2,tbsp,soy sauce,1,tbsp,butter,nan,nan,nan,nan,nan,nan,nan,nan,nan,asian food,hamburger;sausage;accent;salt;chopped onion;bread crumbs;milk;cornstarch;sugar;pineapple juice;pineapple chunks;boullion;water;vinegar;soy sauce;butter;nan;nan;nan,"['hamburger', ';', 'sausage', ';', 'accent', ';', 'salt', ';', 'chopped', 'onion', ';', 'bread', 'crumbs', ';', 'milk', ';', 'cornstarch', ';', 'sugar', ';', 'pineapple', 'juice', ';', 'pineapple', 'chunks', ';', 'boullion', ';', 'water', ';', 'vinegar', ';', 'soy', 'sauce', ';', 'butter', ';', 'nan', ';', 'nan', ';', 'nan']","['sugar', 'milk']"
Saucy Shrimp Over Chinese Noodle Cakes,"Prepare Chinese noodle cakes. Combine water, 1 tablespoon cornstarch and 3 tablespoons soy sauce with ketchup; set aside. Blend remaining 1 tablespoon each cornstarch and soy sauce in small bowl; stir in shrimp until coated. Heat 1 tablespoon oil in hot wok or large skillet over high heat. Add shrimp and stir-fry 1 minute; remove. Heat reamining 1 tablespoon oil in same pan. Add garlic and ginger; stir-fry until fragrant. Add green pepper, onion and celery; stir-fry 4 minutes. Stir in soy sauce mixture, shrimp and tomatoes. Cook and stir until sauce boils and thickens. Cut Chinese noodle cakes into squares and serve with shrimp mixture.",1.25,cups,water,2,tbsp,cornstarch,4,tbsp,soy sauce,1,tsp,ketchup, 1/2,lb,"medium-size raw shrimp, peeled and deveined",2,tbsp,vegetable oil,1,clove,minced garlic, 1/2,tsp,minced ginger,1,nan,"green bell pepper, chunked",1,nan,"medum onion, chunked",2,stalks,"celery, thinly sliced diagonally",2,nan,tomatoes,nan,nan,chinese noodle cakes,nan,nan,nan,nan,nan,nan,nan,nan,nan,nan,nan,nan,nan,nan,nan,nan,nan,nan,asian food,"water;cornstarch;soy sauce;ketchup;medium-size raw shrimp, peeled and deveined;vegetable oil;minced garlic;minced ginger;green bell pepper, chunked;medum onion, chunked;celery, thinly sliced diagonally;tomatoes;chinese noodle cakes;nan;nan;nan;nan;nan;nan","['water', ';', 'cornstarch', ';', 'soy', 'sauce', ';', 'ketchup', ';', 'medium-size', 'raw', 'shrimp', ',', 'peeled', 'and', 'deveined', ';', 'vegetable', 'oil', ';', 'minced', 'garlic', ';', 'minced', 'ginger', ';', 'green', 'bell', 'pepper', ',', 'chunked', ';', 'medum', 'onion', ',', 'chunked', ';', 'celery', ',', 'thinly', 'sliced', 'diagonally', ';', 'tomatoes', ';', 'chinese', 'noodle', 'cakes', ';', 'nan', ';', 'nan', ';', 'nan', ';', 'nan', ';', 'nan', ';', 'nan']",[]
Sole Thermidor,"Roll fish, cook in milk for 30 minutes at 375 degrees. Drain milk, make sauce with remaining ingredients, sprinkle with paprika. Pour over fish. Broil quickly. Serves 4-5.Line bottom of baking dish with half of the bacon. Cover with onion. Sprinkle on bay leaf. Place trout on top. Blend flour and margerine, spread on fish. Sprinkle with crumbs. Top with bacon. Bake uncovered at 375 degrees for 35-45 minutes until golden brown and flakey.",3,lb,fish fillets,2 1/4,cups,milk,1 1/2,tsp,salt, 1/8,tsp,pepper, 1/2,cup,margerine, 1/2,cup,flour, 1/2,cup,lemon juice or sherry, 1/2,lb,grated cheese,4,nan,chopped green onions,8,nan,sliced mushrooms,nan,nan,paprika,nan,nan,nan,nan,nan,nan,nan,nan,nan,nan,nan,nan,nan,nan,nan,nan,nan,nan,nan,nan,nan,nan,nan,nan,asian food,fish fillets;milk;salt;pepper;margerine;flour;lemon juice or sherry;grated cheese;chopped green onions;sliced mushrooms;paprika;nan;nan;nan;nan;nan;nan;nan;nan,"['fish', 'fillets', ';', 'milk', ';', 'salt', ';', 'pepper', ';', 'margerine', ';', 'flour', ';', 'lemon', 'juice', 'or', 'sherry', ';', 'grated', 'cheese', ';', 'chopped', 'green', 'onions', ';', 'sliced', 'mushrooms', ';', 'paprika', ';', 'nan', ';', 'nan', ';', 'nan', ';', 'nan', ';', 'nan', ';', 'nan', ';', 'nan', ';', 'nan']","['milk', 'flour']"
Bake Trout,nan,2,nan,slices bacon for each,1,nan,"onion, thinly sliced",1,nan,"bay leaf, crumbled",3,tbsp,margerine,2,tbsp,flour, 1/2,cup,fine cracker crumbs,nan,nan,salt and pepper,nan,nan,nan,nan,nan,nan,nan,nan,nan,nan,nan,nan,nan,nan,nan,nan,nan,nan,nan,nan,nan,nan,nan,nan,nan,nan,nan,nan,nan,nan,nan,nan,nan,nan,nan,nan,asian food,"slices bacon for each;onion, thinly sliced;bay leaf, crumbled;margerine;flour;fine cracker crumbs;salt and pepper;nan;nan;nan;nan;nan;nan;nan;nan;nan;nan;nan;nan","['slices', 'bacon', 'for', 'each', ';', 'onion', ',', 'thinly', 'sliced', ';', 'bay', 'leaf', ',', 'crumbled', ';', 'margerine', ';', 'flour', ';', 'fine', 'cracker', 'crumbs', ';', 'salt', 'and', 'pepper', ';', 'nan', ';', 'nan', ';', 'nan', ';', 'nan', ';', 'nan', ';', 'nan', ';', 'nan', ';', 'nan', ';', 'nan', ';', 'nan', ';', 'nan', ';', 'nan']",['flour']
Cheesy Fish Fillets with Spinach,"Heat butter over low heat until melted. Stir in flour, bouillon, nutmeg, red pepper and white pepper; cook over low heat, stirring constantly, until mixture is smooth and bubbly. Stir in milk; heat to boiling and cook, stirring constantly, for 1 minute. Add cheese and cook, stirring constantly, just until cheese melts. Set aside. Place spinach in ungreased 12 in x 7.5 in baking dish or 8 in square baking dish. Sprinkle with the lemon juice. Arrange fish on spinach; sprinkle with salt. Spread sauce over fish and spinach. Bake uncovered, at 350 degrees until fish flakes easily with a fork, about 20 minutes. Sprinkle with the Parmesan cheese and paprika; return to oven for 5 minutes.",2,tbsp,butter,2,tbsp,flour,1,tsp,chicken bouillon,nan,dash,nutmeg,nan,dash,red pepper,nan,dash,white pepper,1,cup,milk, 2/3,cup,shredded Swiss or cheddar cheese,1,pkg,"spinach, thawed and well-drained",1,tbsp,lemon juice or sherry,1,lb,"fish fillets, cut in serving pieces", 1/2,tsp,salt,2,tbsp,grated parmesan cheese,nan,nan,paprika,nan,nan,nan,nan,nan,nan,nan,nan,nan,nan,nan,nan,nan,nan,nan,asian food,"butter;flour;chicken bouillon;nutmeg;red pepper;white pepper;milk;shredded Swiss or cheddar cheese;spinach, thawed and well-drained;lemon juice or sherry;fish fillets, cut in serving pieces;salt;grated parmesan cheese;paprika;nan;nan;nan;nan;nan","['butter', ';', 'flour', ';', 'chicken', 'bouillon', ';', 'nutmeg', ';', 'red', 'pepper', ';', 'white', 'pepper', ';', 'milk', ';', 'shredded', 'Swiss', 'or', 'cheddar', 'cheese', ';', 'spinach', ',', 'thawed', 'and', 'well-drained', ';', 'lemon', 'juice', 'or', 'sherry', ';', 'fish', 'fillets', ',', 'cut', 'in', 'serving', 'pieces', ';', 'salt', ';', 'grated', 'parmesan', 'cheese', ';', 'paprika', ';', 'nan', ';', 'nan', ';', 'nan', ';', 'nan', ';', 'nan']","['milk', 'flour']"
Cheese Fondue,"Serve with warm chips, baked 6-7 minutes with cumin.",1,pkg,melted Mexican blend cheese,1,cup,salsa,1,pkg,chopped spinach,1,can,artichoke hearts,nan,nan,nan,nan,nan,nan,nan,nan,nan,nan,nan,nan,nan,nan,nan,nan,nan,nan,nan,nan,nan,nan,nan,nan,nan,nan,nan,nan,nan,nan,nan,nan,nan,nan,nan,nan,nan,nan,nan,nan,nan,nan,nan,nan,nan,asian food,melted Mexican blend cheese;salsa;chopped spinach;artichoke hearts;nan;nan;nan;nan;nan;nan;nan;nan;nan;nan;nan;nan;nan;nan;nan,"['melted', 'Mexican', 'blend', 'cheese', ';', 'salsa', ';', 'chopped', 'spinach', ';', 'artichoke', 'hearts', ';', 'nan', ';', 'nan', ';', 'nan', ';', 'nan', ';', 'nan', ';', 'nan', ';', 'nan', ';', 'nan', ';', 'nan', ';', 'nan', ';', 'nan', ';', 'nan', ';', 'nan', ';', 'nan', ';', 'nan']",[]
Sauteed Scallops,Roll scallops in crumbs and paprika. Saute in butter until golden on all sides. Remove. Add wine or lemon to butter. Add onion to make sauce. Serve with rice.,1,lb,scallops,1,cup,very fine bread crumbs,nan,nan,paprika,nan,nan,butter,1,tbsp,minced onion,nan,nan,salt,nan,nan,pepper,2,tbsp,lemon juice or white wine,nan,nan,nan,nan,nan,nan,nan,nan,nan,nan,nan,nan,nan,nan,nan,nan,nan,nan,nan,nan,nan,nan,nan,nan,nan,nan,nan,nan,nan,nan,nan,nan,nan,asian food,scallops;very fine bread crumbs;paprika;butter;minced onion;salt;pepper;lemon juice or white wine;nan;nan;nan;nan;nan;nan;nan;nan;nan;nan;nan,"['scallops', ';', 'very', 'fine', 'bread', 'crumbs', ';', 'paprika', ';', 'butter', ';', 'minced', 'onion', ';', 'salt', ';', 'pepper', ';', 'lemon', 'juice', 'or', 'white', 'wine', ';', 'nan', ';', 'nan', ';', 'nan', ';', 'nan', ';', 'nan', ';', 'nan', ';', 'nan', ';', 'nan', ';', 'nan', ';', 'nan', ';', 'nan']",[]
"""Louies"" Linguini with Clam Sauce",nan,1,lb,linguini, 1/4,cup,butter,1 to 2,cloves,minced garlic,2,tbsp,flour,2,tbsp,flour,2,cans,chopped clams, 1/4,cup,white wine with clam juice and enough half-and-half to make 2 cups of liquid, 1/4,cup,chopped parsley, 1/2,tsp,dried thyme,nan,nan,salt,nan,nan,pepper,nan,nan,nan,nan,nan,nan,nan,nan,nan,nan,nan,nan,nan,nan,nan,nan,nan,nan,nan,nan,nan,nan,nan,nan,asian food,linguini;butter;minced garlic;flour;flour;chopped clams;white wine with clam juice and enough half-and-half to make 2 cups of liquid;chopped parsley;dried thyme;salt;pepper;nan;nan;nan;nan;nan;nan;nan;nan,"['linguini', ';', 'butter', ';', 'minced', 'garlic', ';', 'flour', ';', 'flour', ';', 'chopped', 'clams', ';', 'white', 'wine', 'with', 'clam', 'juice', 'and', 'enough', 'half-and-half', 'to', 'make', '2', 'cups', 'of', 'liquid', ';', 'chopped', 'parsley', ';', 'dried', 'thyme', ';', 'salt', ';', 'pepper', ';', 'nan', ';', 'nan', ';', 'nan', ';', 'nan', ';', 'nan', ';', 'nan', ';', 'nan', ';', 'nan']",['flour']
Sole Almondie,"Cut fillets into 4 serving pieces and pat dry. Mix flour, sald t and pepper. Dp fish into milk and then coat with 4 mixture. Heat oil and margarine in large skillet over medium heat until hot. Cook fillets, 6-8 minutes until golden brown, turn once during cooking. Remove fish, keep warm. Drain oil from skillet. Add lemon juice, wine and almonds. Boil for 30 seconds and pour over fish.",1,pound,sole filets, 1/2,cup,flour, 1/2,tsp,salt, 1/4,tsp,white pepper, 1/4,cup,milk,4,tbsp,vegetable oil,1,tbsp,margarine,2,tbsp,lemon juice,1,tbsp,"almonds, sliced thin",nan,splash,white wine,nan,nan,nan,nan,nan,nan,nan,nan,nan,nan,nan,nan,nan,nan,nan,nan,nan,nan,nan,nan,nan,nan,nan,nan,nan,nan,nan,asian food,"sole filets;flour;salt;white pepper;milk;vegetable oil;margarine;lemon juice;almonds, sliced thin;white wine;nan;nan;nan;nan;nan;nan;nan;nan;nan","['sole', 'filets', ';', 'flour', ';', 'salt', ';', 'white', 'pepper', ';', 'milk', ';', 'vegetable', 'oil', ';', 'margarine', ';', 'lemon', 'juice', ';', 'almonds', ',', 'sliced', 'thin', ';', 'white', 'wine', ';', 'nan', ';', 'nan', ';', 'nan', ';', 'nan', ';', 'nan', ';', 'nan', ';', 'nan', ';', 'nan', ';', 'nan']","['milk', 'flour']"
Hot Crab Dip,Stir together all ingredients and top with cheddar cheese. Bake for 15-20 minutes. Serve with crackers.,2,pkg,cream cheese,3 to 4,tbsp,mayonaise,4,tsp,worchester,2,cans,crab meat,nan,nan,garlic,nan,nan,cheddar cheese,nan,nan,nan,nan,nan,nan,nan,nan,nan,nan,nan,nan,nan,nan,nan,nan,nan,nan,nan,nan,nan,nan,nan,nan,nan,nan,nan,nan,nan,nan,nan,nan,nan,nan,nan,nan,nan,nan,nan,asian food,cream cheese;mayonaise;worchester;crab meat;garlic;cheddar cheese;nan;nan;nan;nan;nan;nan;nan;nan;nan;nan;nan;nan;nan,"['cream', 'cheese', ';', 'mayonaise', ';', 'worchester', ';', 'crab', 'meat', ';', 'garlic', ';', 'cheddar', 'cheese', ';', 'nan', ';', 'nan', ';', 'nan', ';', 'nan', ';', 'nan', ';', 'nan', ';', 'nan', ';', 'nan', ';', 'nan', ';', 'nan', ';', 'nan', ';', 'nan', ';', 'nan']",[]
Shrimp Saute,"In a skillet, melt butter over medium heat. Add shrimp, mushrooms, green pepper and garlic. Saute until shrimp turn pink, about 3-5 minutes. Meanwhile, cook pasta according to package directions; drain and place on a large serving platter. Top with shrimp mixture. Sprinkle with cheese, salt, pepper and parsley. Toss well; garnish with lemon. Serve immediately.", 1/4,cup,butter or margarine,1,pound,"raw shrimp, peeled and deveined", 1/2,pound,"fresh mushrooms, sliced", 1/2,small,"green pepper, chopped",1,clove,"cloves, minced",3,ounces,linguini or spaghetti,8,cup,grated Romano cheese, 1/2,tsp,salt, 1/2,tsp,pepper, 1/4,nan,"fresh parsely, chopped",nan,nan,lemon slices,nan,nan,nan,nan,nan,nan,nan,nan,nan,nan,nan,nan,nan,nan,nan,nan,nan,nan,nan,nan,nan,nan,nan,nan,asian food,"butter or margarine;raw shrimp, peeled and deveined;fresh mushrooms, sliced;green pepper, chopped;cloves, minced;linguini or spaghetti;grated Romano cheese;salt;pepper;fresh parsely, chopped;lemon slices;nan;nan;nan;nan;nan;nan;nan;nan","['butter', 'or', 'margarine', ';', 'raw', 'shrimp', ',', 'peeled', 'and', 'deveined', ';', 'fresh', 'mushrooms', ',', 'sliced', ';', 'green', 'pepper', ',', 'chopped', ';', 'cloves', ',', 'minced', ';', 'linguini', 'or', 'spaghetti', ';', 'grated', 'Romano', 'cheese', ';', 'salt', ';', 'pepper', ';', 'fresh', 'parsely', ',', 'chopped', ';', 'lemon', 'slices', ';', 'nan', ';', 'nan', ';', 'nan', ';', 'nan', ';', 'nan', ';', 'nan', ';', 'nan', ';', 'nan']",[]
Sitr-Fry Beef and Broccoli,"Cut flank steak across the grain into thin slices. Mix the soy sauce, dry sherry, cornstarch, ginger and garlic ad pour over the beef, tossing to mix well. Cut the broccoli into florets about 2 inches long; slice the stalks into .5 inch pieces. Heat 1 tbsp of the oil in a large, non-stick skillet or wok until hot. Add the beef and stir-fry over high heat until seared, about 2 minutes. Remove beef to a plate. Heat remaining oil in the skillet and add the broccoli and onion. Cook, stirring constantly, for 2 minutes. Add the 2 tablespoons of water or stock, cover the pan, reduce the heat and simmer for 3 to 5 minutes, or until the broccoli is crisp-tender. Stir in the beef and bean sprouts. Toss and stir until heated through.",1 1/4,pounds,flank steak,3,tbsp,soy sauce,1,tbsp,dry sherry,2,tsp,cornstarch,1,tsp,"fresh ginger, grated",1,clove,"garlic, finely chopped", 3/4,pounds,broccoli,2,tbsp,vegetable oil,1,medium,"onion, cut in thin wedges",2,tbsp,water or chicken stock,1,cup,bean sprouts,nan,nan,nan,nan,nan,nan,nan,nan,nan,nan,nan,nan,nan,nan,nan,nan,nan,nan,nan,nan,nan,nan,nan,nan,asian food,"flank steak;soy sauce;dry sherry;cornstarch;fresh ginger, grated;garlic, finely chopped;broccoli;vegetable oil;onion, cut in thin wedges;water or chicken stock;bean sprouts;nan;nan;nan;nan;nan;nan;nan;nan","['flank', 'steak', ';', 'soy', 'sauce', ';', 'dry', 'sherry', ';', 'cornstarch', ';', 'fresh', 'ginger', ',', 'grated', ';', 'garlic', ',', 'finely', 'chopped', ';', 'broccoli', ';', 'vegetable', 'oil', ';', 'onion', ',', 'cut', 'in', 'thin', 'wedges', ';', 'water', 'or', 'chicken', 'stock', ';', 'bean', 'sprouts', ';', 'nan', ';', 'nan', ';', 'nan', ';', 'nan', ';', 'nan', ';', 'nan', ';', 'nan', ';', 'nan']",[]
Barbecued Spareribs,"Baste over ribs while browning until done. If sauce is too thin, thicken with 1 or 2 tablespoons of flour.",1,tsp,salt, 1/8,tsp,pepper,1,tsp,chili powder,1,tsp,celery salt, 1/4,cup,vinegar, 1/4,cup,worchestershire sauce,3,cloves,"garlic, chopped",1,nan,"lemon, sliced thinly", 1/2,cup,"onion, chopped",1,cup,catsup,1,cup,hot water, 1/2,cup,brown sugar,nan,nan,nan,nan,nan,nan,nan,nan,nan,nan,nan,nan,nan,nan,nan,nan,nan,nan,nan,nan,nan,asian food,"salt;pepper;chili powder;celery salt;vinegar;worchestershire sauce;garlic, chopped;lemon, sliced thinly;onion, chopped;catsup;hot water;brown sugar;nan;nan;nan;nan;nan;nan;nan","['salt', ';', 'pepper', ';', 'chili', 'powder', ';', 'celery', 'salt', ';', 'vinegar', ';', 'worchestershire', 'sauce', ';', 'garlic', ',', 'chopped', ';', 'lemon', ',', 'sliced', 'thinly', ';', 'onion', ',', 'chopped', ';', 'catsup', ';', 'hot', 'water', ';', 'brown', 'sugar', ';', 'nan', ';', 'nan', ';', 'nan', ';', 'nan', ';', 'nan', ';', 'nan', ';', 'nan']",['sugar']
Sweet and Sour Pork,"Cut pork tenderloin into chunks. Combine salt, soy sauce, cornstarch and cold water. Marinade pork for 30 minutes. Drain pork and dip a few pieces at a time in a batter made from chicken coating mix, water and egg yolk. Brown pork in hot oil in wok about 3 minutes or until brown. Remove with slotted spoon. Stir in green pepper carrot and onion. Combine catsup, brown sugar, granulated sugar, cinnamon, ginger, lemon and pineapple. Cook until sauce thickens. Add pork mixture and serve over rice.",1,pound,pork 10derloin, 1/2,tsp,salt,1 1/2,tsp,soy sauce,1,tbsp,cornstarch,1,tbsp,cold water, 1/2,cup,chicken coasting mix, 1/2,cup,ice water,1,nan,egg yolk,nan,nan,nan,nan,nan,nan,nan,nan,nan,nan,nan,nan,nan,nan,nan,nan,nan,nan,nan,nan,nan,nan,nan,nan,nan,nan,nan,nan,nan,nan,nan,nan,nan,asian food,pork 10derloin;salt;soy sauce;cornstarch;cold water;chicken coasting mix;ice water;egg yolk;nan;nan;nan;nan;nan;nan;nan;nan;nan;nan;nan,"['pork', '10derloin', ';', 'salt', ';', 'soy', 'sauce', ';', 'cornstarch', ';', 'cold', 'water', ';', 'chicken', 'coasting', 'mix', ';', 'ice', 'water', ';', 'egg', 'yolk', ';', 'nan', ';', 'nan', ';', 'nan', ';', 'nan', ';', 'nan', ';', 'nan', ';', 'nan', ';', 'nan', ';', 'nan', ';', 'nan', ';', 'nan']",[]
Beef Scallops with Fresh Tomato Sauce,"Pound steak to 1/8 inch thick. remove skins from blanched tomatoes. Chop 3 of them and slice the other 2. Set aside. Cook steak in oil on medium high until browned. Remove and keep warm. Add chopped tomatoes to skillet, with green onions. Add sugar, salt, and basil. Stir in cornstarch. Add sliced tomatoes and heat. Gently spoon over meat.",2,pound,beef round steak,5,nan,"tomatoes, blanched",2,tbsp,"green onions, chopped",1,tbsp,sugar,1 1/2,tsp,salt,1,tsp,basil,1,tbsp,cornstarch,nan,nan,nan,nan,nan,nan,nan,nan,nan,nan,nan,nan,nan,nan,nan,nan,nan,nan,nan,nan,nan,nan,nan,nan,nan,nan,nan,nan,nan,nan,nan,nan,nan,nan,nan,nan,asian food,"beef round steak;tomatoes, blanched;green onions, chopped;sugar;salt;basil;cornstarch;nan;nan;nan;nan;nan;nan;nan;nan;nan;nan;nan;nan","['beef', 'round', 'steak', ';', 'tomatoes', ',', 'blanched', ';', 'green', 'onions', ',', 'chopped', ';', 'sugar', ';', 'salt', ';', 'basil', ';', 'cornstarch', ';', 'nan', ';', 'nan', ';', 'nan', ';', 'nan', ';', 'nan', ';', 'nan', ';', 'nan', ';', 'nan', ';', 'nan', ';', 'nan', ';', 'nan', ';', 'nan']",['sugar']
Veal Scallopini,"Cut meat into 2 inch pieces and coat in flour. Brown in oil. Add mushrooms, salt, pepper, and wine. Pour over meat in a casserole. Cook in covered casserole for 1 hour at 375 degrees or a heavy covered skillet at low heat for 45 minutes.",2,pounds,"veal steak, sliced thinly", 1/2,cup,flour,4,tbsp,oil,1,can,sliced mushrooms,2,cups,sauterne wine, 1/4,cup,onion,nan,nan,salt and pepper,nan,nan,nan,nan,nan,nan,nan,nan,nan,nan,nan,nan,nan,nan,nan,nan,nan,nan,nan,nan,nan,nan,nan,nan,nan,nan,nan,nan,nan,nan,nan,nan,nan,nan,nan,nan,asian food,"veal steak, sliced thinly;flour;oil;sliced mushrooms;sauterne wine;onion;salt and pepper;nan;nan;nan;nan;nan;nan;nan;nan;nan;nan;nan;nan","['veal', 'steak', ',', 'sliced', 'thinly', ';', 'flour', ';', 'oil', ';', 'sliced', 'mushrooms', ';', 'sauterne', 'wine', ';', 'onion', ';', 'salt', 'and', 'pepper', ';', 'nan', ';', 'nan', ';', 'nan', ';', 'nan', ';', 'nan', ';', 'nan', ';', 'nan', ';', 'nan', ';', 'nan', ';', 'nan', ';', 'nan', ';', 'nan']",['flour']
Savory Goulash,Brown onion and meat. Add tomato sauce and water. Cook for 2 hours and serve over hot noodles.,2,nan,sliced onions,3,tbsp,wesson oil,1 1/2,pounds,"steak, cubed",3,tsp,paprika,1 1/2,tsp,salt,1,cup,hot water,8,ounces,tomato sauce,4,tbsp,sour cream,nan,nan,hot buttered noodles,nan,nan,nan,nan,nan,nan,nan,nan,nan,nan,nan,nan,nan,nan,nan,nan,nan,nan,nan,nan,nan,nan,nan,nan,nan,nan,nan,nan,nan,nan,asian food,"sliced onions;wesson oil;steak, cubed;paprika;salt;hot water;tomato sauce;sour cream;hot buttered noodles;nan;nan;nan;nan;nan;nan;nan;nan;nan;nan","['sliced', 'onions', ';', 'wesson', 'oil', ';', 'steak', ',', 'cubed', ';', 'paprika', ';', 'salt', ';', 'hot', 'water', ';', 'tomato', 'sauce', ';', 'sour', 'cream', ';', 'hot', 'buttered', 'noodles', ';', 'nan', ';', 'nan', ';', 'nan', ';', 'nan', ';', 'nan', ';', 'nan', ';', 'nan', ';', 'nan', ';', 'nan', ';', 'nan']",[]
Veal Parmigan,"Combine first 8 ingredients and simmer for 1 hour over medium-low heat. Dip Veal in egg and then in crumbs, mixed with half cup of parmesan. Brown lightly in hot oil. Place in single layer in large baking dish. Pour 2/3 cup of sauce over meat and bake at 350 degrees for 30 minutes. Place a slice of mozzarella on each meat slice. SPrinkle with remaining parmesan. return to oven for about 15 minutes.",3,tbsp,oil,3,cloves,"garlic, minced",1,nan,"onion, chopped",32,ounces,"tomatoes, canned",1 1/2,tsp,salt, 1/2,tsp,pepper,8,ounces,tomato sauce,0.25,tsp,thyme,1,pound,"veal, sliced thinly",1,nan,"egg, bea10",1 1/2,cups,bread crumbs, 1/2,cup,grated parmesan cheese,3,tbsp,oil, 1/2,pound,"mozzarella, sliced thinly", 1/4,cup,parmesan,nan,nan,nan,nan,nan,nan,nan,nan,nan,nan,nan,nan,asian food,"oil;garlic, minced;onion, chopped;tomatoes, canned;salt;pepper;tomato sauce;thyme;veal, sliced thinly;egg, bea10;bread crumbs;grated parmesan cheese;oil;mozzarella, sliced thinly;parmesan;nan;nan;nan;nan","['oil', ';', 'garlic', ',', 'minced', ';', 'onion', ',', 'chopped', ';', 'tomatoes', ',', 'canned', ';', 'salt', ';', 'pepper', ';', 'tomato', 'sauce', ';', 'thyme', ';', 'veal', ',', 'sliced', 'thinly', ';', 'egg', ',', 'bea10', ';', 'bread', 'crumbs', ';', 'grated', 'parmesan', 'cheese', ';', 'oil', ';', 'mozzarella', ',', 'sliced', 'thinly', ';', 'parmesan', ';', 'nan', ';', 'nan', ';', 'nan', ';', 'nan']",[]
Teriyaki Steak,"Marinate for at least 1 hour. Grill over hot coals for about 4 minutes on each side for a 1 inch, rare steak. 5 to 6 minutes for medium-rare.", 1/2,cup,soy sauce, 1/2,cup,white wine,2,tbsp,sugar,1 1/2,tsp,ginger,1,clove,"garlic, chopped",nan,nan,nan,nan,nan,nan,nan,nan,nan,nan,nan,nan,nan,nan,nan,nan,nan,nan,nan,nan,nan,nan,nan,nan,nan,nan,nan,nan,nan,nan,nan,nan,nan,nan,nan,nan,nan,nan,nan,nan,nan,nan,asian food,"soy sauce;white wine;sugar;ginger;garlic, chopped;nan;nan;nan;nan;nan;nan;nan;nan;nan;nan;nan;nan;nan;nan","['soy', 'sauce', ';', 'white', 'wine', ';', 'sugar', ';', 'ginger', ';', 'garlic', ',', 'chopped', ';', 'nan', ';', 'nan', ';', 'nan', ';', 'nan', ';', 'nan', ';', 'nan', ';', 'nan', ';', 'nan', ';', 'nan', ';', 'nan', ';', 'nan', ';', 'nan', ';', 'nan', ';', 'nan']",['sugar']
