Title,Directions,Quantity,Unit01,Ingredient01,Quantity02,Unit02,Ingredient02,Quantity03,Unit03,Ingredient03,Quantity04,Unit04,Ingredient04,Quantity05,Unit05,Ingredient05,Quantity06,Unit06,Ingredient06,Quantity07,Unit07,Ingredient07,Quantity08,Unit08,Ingredient08,Quantity09,Unit09,Ingredient09,Quantity10,Unit10,Ingredient10,Quantity11,Unit11,Ingredient11,Quantity12,Unit12,Ingredient12,Quantity13,Unit13,Ingredient13,Quantity14,Unit14,Ingredient14,Quantity15,Unit15,Ingredient15,Quantity16,Unit16,Ingredient16,Quantity17,Unit17,Ingredient17,Quantity18,Unit18,Ingredient18,Quantity19,Unit19,Ingredient19,Category,ingredients,tokenized_ingr,ingr_json
Banana Cake,Bake in three layer pans at 350 degrees., 1/2,cup,shortening,1 1/2,cups,sugar,2,nan,eggs,pinch,salt,nan, 1/2,cup,sour milk,1,tsp,soda water,1 3/4,cups,flour,1 1/2,tsp,baking powder, 1/2,cup,chopped nuts,nan,nan,nan,nan,nan,nan,nan,nan,nan,nan,nan,nan,nan,nan,nan,nan,nan,nan,nan,nan,nan,nan,nan,nan,nan,nan,nan,nan,nan,nan,cakes,shortening;sugar;eggs;nan;sour milk;soda water;flour;baking powder;chopped nuts;nan;nan;nan;nan;nan;nan;nan;nan;nan;nan,"['shortening', ';', 'sugar', ';', 'eggs', ';', 'nan', ';', 'sour', 'milk', ';', 'soda', 'water', ';', 'flour', ';', 'baking', 'powder', ';', 'chopped', 'nuts', ';', 'nan', ';', 'nan', ';', 'nan', ';', 'nan', ';', 'nan', ';', 'nan', ';', 'nan', ';', 'nan', ';', 'nan', ';', 'nan']","['sugar', 'flour', 'milk', 'eggs']"
Blueberry Coffee Cake,"Mix butter, 1 cup sugar, flour, 2 eggs, 2 tsp vanilla, baking powder, and milk to make cake batter. Blend easily. Add 3 cups of blueberries. Put 2 1/2 cups of batter in pan.Mix cream cheese, 1/2 cup sugar, 1 egg, lemon juice and 1 tsp vanilla to make filling. Put filling on top of batter. Top with remaining batter.Make streusel topping from flour, butter, brown sugar, ad cinnamon. Sprinkle on top of cake.Bake at 375 degrees for 1 hour and 5 minutes. Check after 50 minutes.",12,ounces,cream cheese,1 1/2,cups,sugar,3,nan,eggs,1,tbps,lemon juice,3,tsp,vanilla, 1/4,cup,butter,4,cups,flour,1,tbsp + 1 tsp,baking powder,1,cup,milk,3,cups,blueberries,nan,nan,nan,nan,nan,nan,nan,nan,nan,nan,nan,nan,nan,nan,nan,nan,nan,nan,nan,nan,nan,nan,nan,nan,nan,nan,nan,cakes,cream cheese;sugar;eggs;lemon juice;vanilla;butter;flour;baking powder;milk;blueberries;nan;nan;nan;nan;nan;nan;nan;nan;nan,"['cream', 'cheese', ';', 'sugar', ';', 'eggs', ';', 'lemon', 'juice', ';', 'vanilla', ';', 'butter', ';', 'flour', ';', 'baking', 'powder', ';', 'milk', ';', 'blueberries', ';', 'nan', ';', 'nan', ';', 'nan', ';', 'nan', ';', 'nan', ';', 'nan', ';', 'nan', ';', 'nan', ';', 'nan']","['sugar', 'flour', 'milk', 'eggs']"
Chocolate Cake,Mix all ingredients together. Pour in 1 cup boiling water. Mix well. Bake about 35 minutes at 375 degrees., 1/2,cup,margarine,2,cups,sugar,2,nan,eggs,5,tbsp,cocoa, 1/2,tsp,salt, 1/2,cup,sour milk,2,tsp,baking soda,2,cups,flour, 1/2,tsp,cloves,1,tsp,vanilla,nan,nan,nan,nan,nan,nan,nan,nan,nan,nan,nan,nan,nan,nan,nan,nan,nan,nan,nan,nan,nan,nan,nan,nan,nan,nan,nan,cakes,margarine;sugar;eggs;cocoa;salt;sour milk;baking soda;flour;cloves;vanilla;nan;nan;nan;nan;nan;nan;nan;nan;nan,"['margarine', ';', 'sugar', ';', 'eggs', ';', 'cocoa', ';', 'salt', ';', 'sour', 'milk', ';', 'baking', 'soda', ';', 'flour', ';', 'cloves', ';', 'vanilla', ';', 'nan', ';', 'nan', ';', 'nan', ';', 'nan', ';', 'nan', ';', 'nan', ';', 'nan', ';', 'nan', ';', 'nan']","['sugar', 'flour', 'milk', 'cocoa', 'eggs']"
Chocolate Mayonaise Cake,Makes 2 layer cake.,3,cups,flour,1 1/2,cups,sugar, 1/3,cup,cocoa,2 1/4,tsp,baking powder,1 1/2,tsp,baking soda,1 1/2,cups,Best Foods Mayonnaise,1 1/2,cups,water,1 1/2,tsp,vanilla,nan,nan,nan,nan,nan,nan,nan,nan,nan,nan,nan,nan,nan,nan,nan,nan,nan,nan,nan,nan,nan,nan,nan,nan,nan,nan,nan,nan,nan,nan,nan,nan,nan,cakes,flour;sugar;cocoa;baking powder;baking soda;Best Foods Mayonnaise;water;vanilla;nan;nan;nan;nan;nan;nan;nan;nan;nan;nan;nan,"['flour', ';', 'sugar', ';', 'cocoa', ';', 'baking', 'powder', ';', 'baking', 'soda', ';', 'Best', 'Foods', 'Mayonnaise', ';', 'water', ';', 'vanilla', ';', 'nan', ';', 'nan', ';', 'nan', ';', 'nan', ';', 'nan', ';', 'nan', ';', 'nan', ';', 'nan', ';', 'nan', ';', 'nan', ';', 'nan']","['sugar', 'flour', 'cocoa']"
Crazy Cake,"Mix first 5 ingredients well, about 4 minutes. Bake at 350 degrees in a 9x13 pan for 35 minutes. Poke holes in warm cake and pour on mixture of powdered sugar and lemon juice.",1,box,lemon cake mix, 3/4,cup,water,1,small pkg,lemon jello, 3/4,cup,vegetable oil,4,nan,eggs,2,cups,powdered sugar, 1/2,cups,lemon juice,nan,nan,nan,nan,nan,nan,nan,nan,nan,nan,nan,nan,nan,nan,nan,nan,nan,nan,nan,nan,nan,nan,nan,nan,nan,nan,nan,nan,nan,nan,nan,nan,nan,nan,nan,nan,cakes,lemon cake mix;water;lemon jello;vegetable oil;eggs;powdered sugar;lemon juice;nan;nan;nan;nan;nan;nan;nan;nan;nan;nan;nan;nan,"['lemon', 'cake', 'mix', ';', 'water', ';', 'lemon', 'jello', ';', 'vegetable', 'oil', ';', 'eggs', ';', 'powdered', 'sugar', ';', 'lemon', 'juice', ';', 'nan', ';', 'nan', ';', 'nan', ';', 'nan', ';', 'nan', ';', 'nan', ';', 'nan', ';', 'nan', ';', 'nan', ';', 'nan', ';', 'nan', ';', 'nan']","['sugar', 'eggs']"
Fresh Apple Cake,"Mix apples and sugar well. Add oil, nuts, and eggs. Add vanilla and dry ingredients. Bake at 350 degrees for 40-45 minutes. Serve with whipped cream or top with cream cheese frosting.",4,cups,diced apples,2,cups,sugar,1,cups,chopped nuts,2,nan,"eggs, well beaten",2,tsp,vanilla,2,cups,flour,2,tsp,baking powder,2,tsp,cinnamon, 1/2,cups,vegetable oil,1,tsp,baking soda,1,tsp,salt,nan,nan,nan,nan,nan,nan,nan,nan,nan,nan,nan,nan,nan,nan,nan,nan,nan,nan,nan,nan,nan,nan,nan,nan,cakes,"diced apples;sugar;chopped nuts;eggs, well beaten;vanilla;flour;baking powder;cinnamon;vegetable oil;baking soda;salt;nan;nan;nan;nan;nan;nan;nan;nan","['diced', 'apples', ';', 'sugar', ';', 'chopped', 'nuts', ';', 'eggs', ',', 'well', 'beaten', ';', 'vanilla', ';', 'flour', ';', 'baking', 'powder', ';', 'cinnamon', ';', 'vegetable', 'oil', ';', 'baking', 'soda', ';', 'salt', ';', 'nan', ';', 'nan', ';', 'nan', ';', 'nan', ';', 'nan', ';', 'nan', ';', 'nan', ';', 'nan']","['sugar', 'eggs', 'flour', 'apples']"
Fresh Pear Cake,"Butter and flour a 9 inch round pan. Peel and slice pears. Blend eggs, sugar, milk, and salt. Add flour, mix well. Fold 1/2 of pears into batter. Pour into pan, fan remaining pears on top. Dot with butter. Bake at 350 degrees about 55 minutes. Sprinkle with powdered sugar.",2,tbps,butter,1 1/2,cups,flour,3,nan,pears,2,nan,eggs,1,cup,sugar, 1/2,cup,milk, 1/8,tsp,salt,nan,nan,powdered sugar,nan,nan,nan,nan,nan,nan,nan,nan,nan,nan,nan,nan,nan,nan,nan,nan,nan,nan,nan,nan,nan,nan,nan,nan,nan,nan,nan,nan,nan,nan,nan,nan,nan,cakes,butter;flour;pears;eggs;sugar;milk;salt;powdered sugar;nan;nan;nan;nan;nan;nan;nan;nan;nan;nan;nan,"['butter', ';', 'flour', ';', 'pears', ';', 'eggs', ';', 'sugar', ';', 'milk', ';', 'salt', ';', 'powdered', 'sugar', ';', 'nan', ';', 'nan', ';', 'nan', ';', 'nan', ';', 'nan', ';', 'nan', ';', 'nan', ';', 'nan', ';', 'nan', ';', 'nan', ';', 'nan']","['flour', 'sugar', 'milk', 'eggs']"
Graham Cracker Cake,"Cream butter and sugar. Add crushed crackers, sour milk, and soda. Stir in nuts. Bake in 10 inch square baking pan. Bake in 350 degree oven for 30-35 minutes. Serve with whipped cream or thin powdered sugar icing.", 1/2,cup,butter,1,cup,sugar,1,cup,sour milk,32,nan,"graham crackers, crushed",1,tsp,baking soda,1,cup,chopped nuts,nan,nan,nan,nan,nan,nan,nan,nan,nan,nan,nan,nan,nan,nan,nan,nan,nan,nan,nan,nan,nan,nan,nan,nan,nan,nan,nan,nan,nan,nan,nan,nan,nan,nan,nan,nan,nan,nan,nan,cakes,"butter;sugar;sour milk;graham crackers, crushed;baking soda;chopped nuts;nan;nan;nan;nan;nan;nan;nan;nan;nan;nan;nan;nan;nan","['butter', ';', 'sugar', ';', 'sour', 'milk', ';', 'graham', 'crackers', ',', 'crushed', ';', 'baking', 'soda', ';', 'chopped', 'nuts', ';', 'nan', ';', 'nan', ';', 'nan', ';', 'nan', ';', 'nan', ';', 'nan', ';', 'nan', ';', 'nan', ';', 'nan', ';', 'nan', ';', 'nan', ';', 'nan', ';', 'nan']","['sugar', 'milk', 'graham']"
Hot Water Chocolate Cake,Mix all ingredients together. Pour in 1 cup boiling water. Mix well. Bake about 35 minutes at 375 degrees., 1/2,cup,margarine,2,cups,sugar,2,nan,eggs,5,tbsp,cocoa, 1/2,tsp,salt, 1/2,cup,sour milk,2,tsp,baking soda,2,cup,flour, 1/2,tsp,cloves,1,tsp,vanilla,nan,nan,nan,nan,nan,nan,nan,nan,nan,nan,nan,nan,nan,nan,nan,nan,nan,nan,nan,nan,nan,nan,nan,nan,nan,nan,nan,cakes,margarine;sugar;eggs;cocoa;salt;sour milk;baking soda;flour;cloves;vanilla;nan;nan;nan;nan;nan;nan;nan;nan;nan,"['margarine', ';', 'sugar', ';', 'eggs', ';', 'cocoa', ';', 'salt', ';', 'sour', 'milk', ';', 'baking', 'soda', ';', 'flour', ';', 'cloves', ';', 'vanilla', ';', 'nan', ';', 'nan', ';', 'nan', ';', 'nan', ';', 'nan', ';', 'nan', ';', 'nan', ';', 'nan', ';', 'nan']","['sugar', 'flour', 'milk', 'cocoa', 'eggs']"
Hungry Bear Cheese Cake,"Combine first 5 ingredients to make crust. Save 1/4 cup for top. Press remaining crumbs evenly over bottom and about 2 inches up sides of a 9 inch spring form pan. Prepare filling: beat cream cheese and cottage cheese until smooth. Add eggs, one at a time, bating well. Blend in lemon juice and vanilla. Mix sugar, flour and salt. Add to cheese mixture. Pour into crust. Bake at 350 degrees until set, about 35 to 40 minutes. Combine topping ingredients (sour cream, sugar, vanilla, and salt). Spread evenly over hot cheese cake. Return to oven until cream sets, about 5 minutes. Cool in pan on rack. Sprinkle reserved crumbs around edge of cake.", 1/4,cup,"wheat germ, optional",1 3/4,cup,graham cracker crumbs,3,tbsp,sugar,1,tsp,cinnamon, 1/3,cup,melted butter, 1/2,pint,sour cream, 1/3,cup,sugar,1,tsp,vanilla, 1/8,tsp,salt,8,ounces,cream cheese, 1/2,pint,cottage cheese,4,nan,eggs,1,tbsp,lemon juice,2,tsp,vanilla, 2/3,cup,sugar,2,tbsp,flour,2,tbsp,flour, 1/4,tsp,salt,nan,nan,nan,cakes,"wheat germ, optional;graham cracker crumbs;sugar;cinnamon;melted butter;sour cream;sugar;vanilla;salt;cream cheese;cottage cheese;eggs;lemon juice;vanilla;sugar;flour;flour;salt;nan","['wheat', 'germ', ',', 'optional', ';', 'graham', 'cracker', 'crumbs', ';', 'sugar', ';', 'cinnamon', ';', 'melted', 'butter', ';', 'sour', 'cream', ';', 'sugar', ';', 'vanilla', ';', 'salt', ';', 'cream', 'cheese', ';', 'cottage', 'cheese', ';', 'eggs', ';', 'lemon', 'juice', ';', 'vanilla', ';', 'sugar', ';', 'flour', ';', 'flour', ';', 'salt', ';', 'nan']","['graham', 'sugar', 'flour', 'eggs']"
Lemon Poppy Cake,Mix all for 4 minutes. Bake at 350 degrees for 40 minutes.,1,pkg,lemon cake mix,4,nan,eggs,1,small pkg,lemon instant pudding,1,cup,water, 1/2,cup,oil, 1/4,cup,poppy seeds,nan,nan,nan,nan,nan,nan,nan,nan,nan,nan,nan,nan,nan,nan,nan,nan,nan,nan,nan,nan,nan,nan,nan,nan,nan,nan,nan,nan,nan,nan,nan,nan,nan,nan,nan,nan,nan,nan,nan,cakes,lemon cake mix;eggs;lemon instant pudding;water;oil;poppy seeds;nan;nan;nan;nan;nan;nan;nan;nan;nan;nan;nan;nan;nan,"['lemon', 'cake', 'mix', ';', 'eggs', ';', 'lemon', 'instant', 'pudding', ';', 'water', ';', 'oil', ';', 'poppy', 'seeds', ';', 'nan', ';', 'nan', ';', 'nan', ';', 'nan', ';', 'nan', ';', 'nan', ';', 'nan', ';', 'nan', ';', 'nan', ';', 'nan', ';', 'nan', ';', 'nan', ';', 'nan']",['eggs']
Light Old Fashioned Fruit Cake,"Sift dry ingredients into a 4 quart bowl. Add fruit and nuts. Mix until well coated. Set aside. Cream butter, gradually add sugar and cream until fluffy. Add eggs one at a time, beating well after each. Add brandy. Combine with fruit mixture. Mix well. Turn into a 10 inch tube pan or four 1# coffee cans lined with foil, filling pans 2/3 full. Bake in slow oven, 275 degrees for 2 3/4 to 3 hours. About 1/2 hour before done brush lightly with honey or light corn syrup. Cool completely then wrap tightly in foil to store for several weeks. Brush with brandy about once a week.",4,cups,sifted flour, 1/2,tsp,baking powder,1 1/2,tsp,salt,1 1/2,tsp,cinnamon,1,tsp,nutmeg,24,ounces,whole pecans,1 3/4,cups,"canned pineapple, chopped",1 3/4,cups,whole canned cherries,3 1/4,cups,golden raisins,1,cup,butter,2 1/4,cups,sugar,6,nan,eggs,3,tbsp,brandy flavoring,nan,nan,nan,nan,nan,nan,nan,nan,nan,nan,nan,nan,nan,nan,nan,nan,nan,nan,cakes,"sifted flour;baking powder;salt;cinnamon;nutmeg;whole pecans;canned pineapple, chopped;whole canned cherries;golden raisins;butter;sugar;eggs;brandy flavoring;nan;nan;nan;nan;nan;nan","['sifted', 'flour', ';', 'baking', 'powder', ';', 'salt', ';', 'cinnamon', ';', 'nutmeg', ';', 'whole', 'pecans', ';', 'canned', 'pineapple', ',', 'chopped', ';', 'whole', 'canned', 'cherries', ';', 'golden', 'raisins', ';', 'butter', ';', 'sugar', ';', 'eggs', ';', 'brandy', 'flavoring', ';', 'nan', ';', 'nan', ';', 'nan', ';', 'nan', ';', 'nan', ';', 'nan']","['sugar', 'flour', 'eggs']"
My Best Gingerbread,Bake in greased pan for 35 minutes at 325-350 degrees., 1/4,cup,sugar, 1/2,cup,butter,1,nan,egg,1,cup,molasses,2 1/2,cups,sifted flour,1 1/2,tsp,soda,1,tsp,cinnamon,1,tsp,ginger, 1/2,tsp,cloves, 1/2,tsp,salt,1,cup,hot water,nan,nan,nan,nan,nan,nan,nan,nan,nan,nan,nan,nan,nan,nan,nan,nan,nan,nan,nan,nan,nan,nan,nan,nan,cakes,sugar;butter;egg;molasses;sifted flour;soda;cinnamon;ginger;cloves;salt;hot water;nan;nan;nan;nan;nan;nan;nan;nan,"['sugar', ';', 'butter', ';', 'egg', ';', 'molasses', ';', 'sifted', 'flour', ';', 'soda', ';', 'cinnamon', ';', 'ginger', ';', 'cloves', ';', 'salt', ';', 'hot', 'water', ';', 'nan', ';', 'nan', ';', 'nan', ';', 'nan', ';', 'nan', ';', 'nan', ';', 'nan', ';', 'nan']","['sugar', 'flour']"
Oatmeal Cake,"Pour the water over the oatmeal. Let stand for 20 minutes. Add remaining cake ingredients. Mix well and pour into a greased 9""x12"" pan. Let stand while mixing topping. To prepare topping: Mix all ingredients together over low heat, until butter melts. Spoon over unbaked cake. Bake 45 minutes at 350 degrees.",1,cup,oatmeal,1 1/4,cups,boiling water,1,cup,brown sugar,1,cup,white sugar, 1/2,cup,margarine,2,nan,eggs,1 1/3,cups,flour, 1/2,tsp,salt,1,tsp,soda,1,tsp,nutmeg,1,tsp,cinnamon,1,cup,chopped nuts, 1/2,cup,evaporated milk,6,tbsp,butter,1,cup,coconut,1,tsp,valencia peanuts,nan,nan,nan,nan,nan,nan,nan,nan,nan,cakes,oatmeal;boiling water;brown sugar;white sugar;margarine;eggs;flour;salt;soda;nutmeg;cinnamon;chopped nuts;evaporated milk;butter;coconut;valencia peanuts;nan;nan;nan,"['oatmeal', ';', 'boiling', 'water', ';', 'brown', 'sugar', ';', 'white', 'sugar', ';', 'margarine', ';', 'eggs', ';', 'flour', ';', 'salt', ';', 'soda', ';', 'nutmeg', ';', 'cinnamon', ';', 'chopped', 'nuts', ';', 'evaporated', 'milk', ';', 'butter', ';', 'coconut', ';', 'valencia', 'peanuts', ';', 'nan', ';', 'nan', ';', 'nan']","['sugar', 'milk', 'flour', 'eggs']"
Orange Angel Food Cake,"Prepare angel food cake as directed on package, but pour 1/3 cup of the thawed orange juice into a 2 cup measure and add enough water for the mixture to equal the amount of water called for in package directions. Continue to prepare cake as directed, baking the batter in an ungreased 10 inch tube pan. Immediately invert the cake, leaving in pan. Cool completely. Loosen sides of cake from pan; remove cake. To make the topping, in a medium bowl, gently stir together the thawed topping and yogurt. Fold in remaining orange juice concentrate. Spread topping mixture over top ad sides of cake.",1,15-16 ounce pkg,angel food cake mix, 3/4,cup,"frozen orange juice concentrate, thawed",1,container,"frozen light whipped topping, thawed", 1/2,cup ,plain low fat yogurt,nan,nan,nan,nan,nan,nan,nan,nan,nan,nan,nan,nan,nan,nan,nan,nan,nan,nan,nan,nan,nan,nan,nan,nan,nan,nan,nan,nan,nan,nan,nan,nan,nan,nan,nan,nan,nan,nan,nan,nan,nan,nan,nan,nan,nan,cakes,"angel food cake mix;frozen orange juice concentrate, thawed;frozen light whipped topping, thawed;plain low fat yogurt;nan;nan;nan;nan;nan;nan;nan;nan;nan;nan;nan;nan;nan;nan;nan","['angel', 'food', 'cake', 'mix', ';', 'frozen', 'orange', 'juice', 'concentrate', ',', 'thawed', ';', 'frozen', 'light', 'whipped', 'topping', ',', 'thawed', ';', 'plain', 'low', 'fat', 'yogurt', ';', 'nan', ';', 'nan', ';', 'nan', ';', 'nan', ';', 'nan', ';', 'nan', ';', 'nan', ';', 'nan', ';', 'nan', ';', 'nan', ';', 'nan', ';', 'nan', ';', 'nan', ';', 'nan', ';', 'nan']",[]
Orange-Poppy Seed Pound Cake,"Preheat oven to 325 degrees. Grease and flour a 9x5x3 inch loaf pan; tap out excess flour. In large bowl beat together softened butter, sugar, vanilla, and orange peel until pale and fluffy. Beat in flour, then remaining ingredients, except the glaze (powdered sugar and 2 1/2 tsp. orange juice). Mix until well blended. Spread in prepared pan. With handle of a wooden spoon, make 1/2 inch deep score down center length of batter. Bake 50-60 minutes, until wooden pick inserted in center comes out clean. Cool in pan on rack 30 minutes; invert onto rack; remove pan. Cool completely. To prepare glaze seal powdered sugar and orange juice in small zipper-style bag. Gently massage mixture with fingers until blended and smooth. Snip off corner of bag. Drizzle glaze over cake. Let stand 1 hour or until glaze is set.",1,cup,"unsalted butter, softened",1,cup,sugar,2,tsp,vanilla,2,tsp,grated orange peel,2 1/4,cups,unsifted cake flour, 1/2,cup,fresh orange juice,4,large,eggs, 3/4,tsp,baking powder, 1/4,tsp,baking soda, 1/4,tsp,salt,2,tbsp,poppy seeds, 1/2,cup,powdered sugar,2 1/2,tsp,fresh orange juice,nan,nan,nan,nan,nan,nan,nan,nan,nan,nan,nan,nan,nan,nan,nan,nan,nan,nan,cakes,"unsalted butter, softened;sugar;vanilla;grated orange peel;unsifted cake flour;fresh orange juice;eggs;baking powder;baking soda;salt;poppy seeds;powdered sugar;fresh orange juice;nan;nan;nan;nan;nan;nan","['unsalted', 'butter', ',', 'softened', ';', 'sugar', ';', 'vanilla', ';', 'grated', 'orange', 'peel', ';', 'unsifted', 'cake', 'flour', ';', 'fresh', 'orange', 'juice', ';', 'eggs', ';', 'baking', 'powder', ';', 'baking', 'soda', ';', 'salt', ';', 'poppy', 'seeds', ';', 'powdered', 'sugar', ';', 'fresh', 'orange', 'juice', ';', 'nan', ';', 'nan', ';', 'nan', ';', 'nan', ';', 'nan', ';', 'nan']","['sugar', 'flour', 'eggs']"
Pineapple Cake,Spread pineapple in baking dish. Sprinkle cake mix on this. Dice butter on top. Sprinkle with almonds. Bake at 350 degrees for 30 minutes.,1,2 pound can,crushed pineapple,1,pkg,yellow cake mix,1,cube,butter,1,pkg,sliced almonds,nan,nan,nan,nan,nan,nan,nan,nan,nan,nan,nan,nan,nan,nan,nan,nan,nan,nan,nan,nan,nan,nan,nan,nan,nan,nan,nan,nan,nan,nan,nan,nan,nan,nan,nan,nan,nan,nan,nan,nan,nan,nan,nan,nan,nan,cakes,crushed pineapple;yellow cake mix;butter;sliced almonds;nan;nan;nan;nan;nan;nan;nan;nan;nan;nan;nan;nan;nan;nan;nan,"['crushed', 'pineapple', ';', 'yellow', 'cake', 'mix', ';', 'butter', ';', 'sliced', 'almonds', ';', 'nan', ';', 'nan', ';', 'nan', ';', 'nan', ';', 'nan', ';', 'nan', ';', 'nan', ';', 'nan', ';', 'nan', ';', 'nan', ';', 'nan', ';', 'nan', ';', 'nan', ';', 'nan', ';', 'nan']",[]
Pineapple-Carrot Cake*,"Mix all cake ingredients. Bake in greased and floured 9""x13"" pan at 350 degrees for 35 minutes. Frost when cool.",1,cup,oil,2,cups,sugar,4,nan,eggs,2,cups,flour,1,tsp,soda, 1/2,tsp,salt,1,tsp,cinnamon,1,tsp,vanilla,1,cup,"crushed pineapple, drained",2,cups,grated carrots,1,cup,chopped walnuts,3,ounces,cream cheese, 1/4,pound,margarine,2,cups,powdered sugar,1,tsp,vanilla,2,Tbsp,water,nan,nan,nan,nan,nan,nan,nan,nan,nan,cakes,"oil;sugar;eggs;flour;soda;salt;cinnamon;vanilla;crushed pineapple, drained;grated carrots;chopped walnuts;cream cheese;margarine;powdered sugar;vanilla;water;nan;nan;nan","['oil', ';', 'sugar', ';', 'eggs', ';', 'flour', ';', 'soda', ';', 'salt', ';', 'cinnamon', ';', 'vanilla', ';', 'crushed', 'pineapple', ',', 'drained', ';', 'grated', 'carrots', ';', 'chopped', 'walnuts', ';', 'cream', 'cheese', ';', 'margarine', ';', 'powdered', 'sugar', ';', 'vanilla', ';', 'water', ';', 'nan', ';', 'nan', ';', 'nan']","['sugar', 'eggs', 'flour']"
Potatoe Cake,"Mix in order given.  Bake at 350 degrees for 25 minutes in two, 9"" pans.",2,cups,sugar,1,cup,shortening, 1/2,cup,milk,1,cup,mashed potatoes,4,nan,"eggs, beaten separately",2,cups,flour,2,tsp,baking powder,2,tsp,cocoa,1,cup,chopped walnuts,1,tsp,vanilla,nan,nan,nan,nan,nan,nan,nan,nan,nan,nan,nan,nan,nan,nan,nan,nan,nan,nan,nan,nan,nan,nan,nan,nan,nan,nan,nan,cakes,"sugar;shortening;milk;mashed potatoes;eggs, beaten separately;flour;baking powder;cocoa;chopped walnuts;vanilla;nan;nan;nan;nan;nan;nan;nan;nan;nan","['sugar', ';', 'shortening', ';', 'milk', ';', 'mashed', 'potatoes', ';', 'eggs', ',', 'beaten', 'separately', ';', 'flour', ';', 'baking', 'powder', ';', 'cocoa', ';', 'chopped', 'walnuts', ';', 'vanilla', ';', 'nan', ';', 'nan', ';', 'nan', ';', 'nan', ';', 'nan', ';', 'nan', ';', 'nan', ';', 'nan', ';', 'nan']","['sugar', 'flour', 'milk', 'cocoa', 'eggs']"
Pumpkin Swirl Cheesecake,"CRUST: Combine crumbs and melted margarine, press into bottom and sides of 9 inch form pan.FILLING: Combine cheese, 1/2 cup sugar and vanilla. Mix at medium speed until well blended. Add eggs, one at a time. Reserve 1 cup of this mixture, then add pumpkin, remaining sugar and spices to remaining cheese mixture. Mix well. Layer half of pumpkin mixture an half of cheese mixture over crust. Repeat layers. Cut through bater with knife several times to marble. Bake at 350 degrees for 55 minutes. Loosen from rim of pan. Cool before removing. Chill.",2,cups,vanilla wafer crumbs, 1/4,cups,melted margarine,2,8 oz. pkgs.,lite cream cheese, 3/4,cups,sugar,1,tsp,vanilla,3,nan,eggs,1,cup,pumpkin, 3/4,tsp,cinnamon, 1/4,tsp,nutmeg,nan,nan,nan,nan,nan,nan,nan,nan,nan,nan,nan,nan,nan,nan,nan,nan,nan,nan,nan,nan,nan,nan,nan,nan,nan,nan,nan,nan,nan,nan,cakes,vanilla wafer crumbs;melted margarine;lite cream cheese;sugar;vanilla;eggs;pumpkin;cinnamon;nutmeg;nan;nan;nan;nan;nan;nan;nan;nan;nan;nan,"['vanilla', 'wafer', 'crumbs', ';', 'melted', 'margarine', ';', 'lite', 'cream', 'cheese', ';', 'sugar', ';', 'vanilla', ';', 'eggs', ';', 'pumpkin', ';', 'cinnamon', ';', 'nutmeg', ';', 'nan', ';', 'nan', ';', 'nan', ';', 'nan', ';', 'nan', ';', 'nan', ';', 'nan', ';', 'nan', ';', 'nan', ';', 'nan']","['sugar', 'eggs']"
Refrigerator Cheesecake,"Crush flakes, mix with butter and sugar. Press 3/4 of mixture into spring for pan. Chill. Soften gelatin in water. Beat egg yolks slightly; stir in salt, sugar and milk. Cook over hot water or very low heat. Stir constantly until it thickens. Remove from heat. Stir in softened gelatin. Cool. Beat cheese until creamy. Combine with lemon rind and juice. Add to gelatin mixture, mixing well. Whip cream until stiff. Beat egg whites until stiff but not dry. Fold cheese mixture to whipped cream. Spread in pan over crumb mixture. Sprinkle remaining crumbs on top. Chill until firm.",4,cups,cornflakes, 1/3,cup,butter, 1/4,cup,sugar,1 1/2,tbsp,gelatin, 1/2,cup,cold water,2,nan,"eggs, separated", 1/2,tsp,salt, 1/2,cup,milk,1,pound,cottage cheese,1,tsp,grated lemon rind, 1/4,cup,lemon juice, 1/2,cup,heavy cream,nan,nan,nan,nan,nan,nan,nan,nan,nan,nan,nan,nan,nan,nan,nan,nan,nan,nan,nan,nan,nan,cakes,"cornflakes;butter;sugar;gelatin;cold water;eggs, separated;salt;milk;cottage cheese;grated lemon rind;lemon juice;heavy cream;nan;nan;nan;nan;nan;nan;nan","['cornflakes', ';', 'butter', ';', 'sugar', ';', 'gelatin', ';', 'cold', 'water', ';', 'eggs', ',', 'separated', ';', 'salt', ';', 'milk', ';', 'cottage', 'cheese', ';', 'grated', 'lemon', 'rind', ';', 'lemon', 'juice', ';', 'heavy', 'cream', ';', 'nan', ';', 'nan', ';', 'nan', ';', 'nan', ';', 'nan', ';', 'nan', ';', 'nan']","['sugar', 'milk', 'eggs']"
Sherry Wine Cake,Beat for 5 minutes. Bake for 45 minutes at 350 degrees in angel food pan that has been greased and floured. Turn to 300 degrees after 20 minutes.,1,pkg,yellow cake mix,1,pkg,instant vanilla pudding,4,nan,eggs, 3/4,cup,oil, 3/4,cup,sherry cooking wine,1,tsp,nutmeg,nan,nan,nan,nan,nan,nan,nan,nan,nan,nan,nan,nan,nan,nan,nan,nan,nan,nan,nan,nan,nan,nan,nan,nan,nan,nan,nan,nan,nan,nan,nan,nan,nan,nan,nan,nan,nan,nan,nan,cakes,yellow cake mix;instant vanilla pudding;eggs;oil;sherry cooking wine;nutmeg;nan;nan;nan;nan;nan;nan;nan;nan;nan;nan;nan;nan;nan,"['yellow', 'cake', 'mix', ';', 'instant', 'vanilla', 'pudding', ';', 'eggs', ';', 'oil', ';', 'sherry', 'cooking', 'wine', ';', 'nutmeg', ';', 'nan', ';', 'nan', ';', 'nan', ';', 'nan', ';', 'nan', ';', 'nan', ';', 'nan', ';', 'nan', ';', 'nan', ';', 'nan', ';', 'nan', ';', 'nan', ';', 'nan']",['eggs']
Special Prune Cake*,"Blend sugar and oil. Add beaten eggs. Add dry ingredients with buttermilk. Add vanilla, prunes, and nuts. Pour into buttered pan about 12""x8"" in size. Bake at 300 degrees for 45 minutes. When cake is done and brown remove from oven and while still hot cover with icing. Icing Directions: Put all ingredients in medium saucepan and boil to soft ball stage. This will take 15 or 20 minutes, so start this before cake is to come out of the oven so icing may be poured on to cake immediately. Leave in pan, cut in squares to serve.",3,nan,eggs,1,cup,oil,1 1/2,cups,sugar,1,tsp. each,"nutmeg, cinnamon, and allspice",2,cups,flour, 1/4,tsp,salt,1,tsp,soda, 1/2,tsp,baking powder,1,cup,buttermilk,1,tsp,vanilla,1,cup,cooked prunes, 1/2,cup,chopped nuts,1,cup,sugar, 1/2,cup,buttermilk, 1/2,tsp,soda water,1,tbsp,white corn syrup, 1/4,cup,butter,1,tsp,vanilla,nan,nan,nan,cakes,"eggs;oil;sugar;nutmeg, cinnamon, and allspice;flour;salt;soda;baking powder;buttermilk;vanilla;cooked prunes;chopped nuts;sugar;buttermilk;soda water;white corn syrup;butter;vanilla;nan","['eggs', ';', 'oil', ';', 'sugar', ';', 'nutmeg', ',', 'cinnamon', ',', 'and', 'allspice', ';', 'flour', ';', 'salt', ';', 'soda', ';', 'baking', 'powder', ';', 'buttermilk', ';', 'vanilla', ';', 'cooked', 'prunes', ';', 'chopped', 'nuts', ';', 'sugar', ';', 'buttermilk', ';', 'soda', 'water', ';', 'white', 'corn', 'syrup', ';', 'butter', ';', 'vanilla', ';', 'nan']","['sugar', 'flour', 'eggs']"
