Title,Directions,Quantity,Unit01,Ingredient01,Quantity02,Unit02,Ingredient02,Quantity03,Unit03,Ingredient03,Quantity04,Unit04,Ingredient04,Quantity05,Unit05,Ingredient05,Quantity06,Unit06,Ingredient06,Quantity07,Unit07,Ingredient07,Quantity08,Unit08,Ingredient08,Quantity09,Unit09,Ingredient09,Quantity10,Unit10,Ingredient10,Quantity11,Unit11,Ingredient11,Quantity12,Unit12,Ingredient12,Quantity13,Unit13,Ingredient13,Quantity14,Unit14,Ingredient14,Quantity15,Unit15,Ingredient15,Quantity16,Unit16,Ingredient16,Quantity17,Unit17,Ingredient17,Quantity18,Unit18,Ingredient18,Quantity19,Unit19,Ingredient19,Category,ingredients,tokenized_ingr,ingr_json
Pineapple Graham Bars,"Preheat oven to 350 degrees. Lightly grease 8""x8""x2"" pan. Mix butter with sugar until light. Beat in egg. Stir in flour, graham cracker crumbs, pineapple, and walnuts. Bake 30-35 minutes or until browned and surface is firm to the touch. Let cool completely in plan. Cut into 20 bars.", 1/4,cup,butter or margarine, 1/2,cup,"light brown sugar, firmly packed",1,nan,egg , 1/2,cup,sifted flour, 1/2,cup,graham cracker crumbs,1,8 1/2 oz. can,"crushed pineapple, drained.", 1/2,cup,"walnuts, chopped",nan,nan,nan,nan,nan,nan,nan,nan,nan,nan,nan,nan,nan,nan,nan,nan,nan,nan,nan,nan,nan,nan,nan,nan,nan,nan,nan,nan,nan,nan,nan,nan,nan,nan,nan,nan,cookies,"butter or margarine;light brown sugar, firmly packed;egg ;sifted flour;graham cracker crumbs;crushed pineapple, drained.;walnuts, chopped;nan;nan;nan;nan;nan;nan;nan;nan;nan;nan;nan;nan","['butter', 'or', 'margarine', ';', 'light', 'brown', 'sugar', ',', 'firmly', 'packed', ';', 'egg', ';', 'sifted', 'flour', ';', 'graham', 'cracker', 'crumbs', ';', 'crushed', 'pineapple', ',', 'drained', '.', ';', 'walnuts', ',', 'chopped', ';', 'nan', ';', 'nan', ';', 'nan', ';', 'nan', ';', 'nan', ';', 'nan', ';', 'nan', ';', 'nan', ';', 'nan', ';', 'nan', ';', 'nan', ';', 'nan']","['graham', 'sugar', 'flour']"
Prune Nut Bars,"Cook Prunes - drain and chop. Mix margarine, sugar and 1 cup of four. Press into 9"" square pan. Bake at 350 degrees for 25 minutes.  Sift remaining 1/3 cup flour with baking powder and salt. Beat brown sugar into eggs, lemon and vanilla. Add flour, mix well. Add prunes, nuts, and coconut. Spread over baked bars. Bake at 350 degrees for 30-35 minutes. Cool. Cut into 24 bars. Roll in confectioner's sugar.",1 1/2,cups,pitted prunes, 1/2,cup,margarine, 1/4,cup,sugar,1 1/3,cups,sifted flour, 1/2,tsp,baking powder, 1/4,tsp,salt,1,cup,brown sugar,2,nan,eggs,2,tsp,lemon juice,1,tsp,vanilla,1,cup,"walnuts, chopped", 1/2,cup,coconut,nan,nan,confectioner's sugar,nan,nan,nan,nan,nan,nan,nan,nan,nan,nan,nan,nan,nan,nan,nan,nan,nan,nan,cookies,"pitted prunes;margarine;sugar;sifted flour;baking powder;salt;brown sugar;eggs;lemon juice;vanilla;walnuts, chopped;coconut;confectioner's sugar;nan;nan;nan;nan;nan;nan","['pitted', 'prunes', ';', 'margarine', ';', 'sugar', ';', 'sifted', 'flour', ';', 'baking', 'powder', ';', 'salt', ';', 'brown', 'sugar', ';', 'eggs', ';', 'lemon', 'juice', ';', 'vanilla', ';', 'walnuts', ',', 'chopped', ';', 'coconut', ';', 'confectioner', ""'s"", 'sugar', ';', 'nan', ';', 'nan', ';', 'nan', ';', 'nan', ';', 'nan', ';', 'nan']","['sugar', 'eggs', 'flour']"
Pumpkin Oatmeal Cookies,"Mix eggs, sugar, oil, spices, and pumpkin. Add oats, soda, salt nuts, and raisins. Mix well. Add flour, 1/2 at a time. Drop by teaspoons on ungreased cookie sheet. (These will not spread.) Bake 10 minutes at 325 degrees. Remove from pan. Store in tightly sealed container.",4,nan,eggs,3,cups,sugar,1,cup,oil,3,cups,oatmeal,2,tsp,soda,1,tsp,salt,1,cup,nuts,1,cup,raisins, 1/2,tsp,allspice, 3/4,tsp,ginger,1,tsp,pumpkin pie spice,1,tsp,cinnamon,1,tsp,cloves,1,tsp,nutmeg,1,small can,pumpkin pie spice,4,cups ,flour,nan,nan,nan,nan,nan,nan,nan,nan,nan,cookies,eggs;sugar;oil;oatmeal;soda;salt;nuts;raisins;allspice;ginger;pumpkin pie spice;cinnamon;cloves;nutmeg;pumpkin pie spice;flour;nan;nan;nan,"['eggs', ';', 'sugar', ';', 'oil', ';', 'oatmeal', ';', 'soda', ';', 'salt', ';', 'nuts', ';', 'raisins', ';', 'allspice', ';', 'ginger', ';', 'pumpkin', 'pie', 'spice', ';', 'cinnamon', ';', 'cloves', ';', 'nutmeg', ';', 'pumpkin', 'pie', 'spice', ';', 'flour', ';', 'nan', ';', 'nan', ';', 'nan']","['sugar', 'flour', 'eggs']"
Snickerdoodles,Mix first 7 ingredients. Roll in balls. Dip in mixture of cinnamon and sugar. Bake for 8-10 minutes at 375 degrees. Makes 4 dozen.,2 3/4,cups,flour,2,tsp,cream of tartar,1,tsp,baking soda, 1/2,tsp,salt, 3/4,cups,margarine,1 1/2,cups,sugar,2,nan,eggs,2,Tbps,sugar,1,tsp,cinnamon,nan,nan,nan,nan,nan,nan,nan,nan,nan,nan,nan,nan,nan,nan,nan,nan,nan,nan,nan,nan,nan,nan,nan,nan,nan,nan,nan,nan,nan,nan,cookies,flour;cream of tartar;baking soda;salt;margarine;sugar;eggs;sugar;cinnamon;nan;nan;nan;nan;nan;nan;nan;nan;nan;nan,"['flour', ';', 'cream', 'of', 'tartar', ';', 'baking', 'soda', ';', 'salt', ';', 'margarine', ';', 'sugar', ';', 'eggs', ';', 'sugar', ';', 'cinnamon', ';', 'nan', ';', 'nan', ';', 'nan', ';', 'nan', ';', 'nan', ';', 'nan', ';', 'nan', ';', 'nan', ';', 'nan', ';', 'nan']","['flour', 'sugar', 'eggs']"
Soft Sugar Cookies,"Cream butter. Add sugar gradually while continuing to cream. Ad eggs one at a time, beating well after each. Add vanilla. Beat until light and fluffy. Add mixed dry ingredients, alternately with sour cream; begin and end with dry ingredients. For 3 inch cookies drop by heaping teaspoons. With spatula flatten into circles about 2 inch wide. Sprinkle with sugar and cinnamon. Bake in hot oven - 400 degrees for 10-20 minutes. Makes about thirty - 3 inch cookies.", 1/2,cup,butter or margarine,1 1/2,cups,sugar,2,nan,eggs,1,tsp,vanilla,3,cups,sifted flour,1,tsp,salt, 1/2,tsp,baking powder, 1/2,tsp,baking soda,1,cups,sour cream,nan,nan,cinnamon and sugar,nan,nan,nan,nan,nan,nan,nan,nan,nan,nan,nan,nan,nan,nan,nan,nan,nan,nan,nan,nan,nan,nan,nan,nan,nan,nan,nan,cookies,butter or margarine;sugar;eggs;vanilla;sifted flour;salt;baking powder;baking soda;sour cream;cinnamon and sugar;nan;nan;nan;nan;nan;nan;nan;nan;nan,"['butter', 'or', 'margarine', ';', 'sugar', ';', 'eggs', ';', 'vanilla', ';', 'sifted', 'flour', ';', 'salt', ';', 'baking', 'powder', ';', 'baking', 'soda', ';', 'sour', 'cream', ';', 'cinnamon', 'and', 'sugar', ';', 'nan', ';', 'nan', ';', 'nan', ';', 'nan', ';', 'nan', ';', 'nan', ';', 'nan', ';', 'nan', ';', 'nan']","['sugar', 'flour', 'eggs']"
Thumbprint Cookies,Mix first 5 ingredients. Add flour. Roll into ball.  Make a thumbprint in each ball. Cook 8-10 minutes at 350 degrees. Fill with jelly or chopped nuts., 1/2,cup,Crisco (shortening),1,nan,egg,2,cups,sugar, 1/2,tsp,salt,1,tsp,vanilla,1 2/3,cups,flour,nan,nan,nan,nan,nan,nan,nan,nan,nan,nan,nan,nan,nan,nan,nan,nan,nan,nan,nan,nan,nan,nan,nan,nan,nan,nan,nan,nan,nan,nan,nan,nan,nan,nan,nan,nan,nan,nan,nan,cookies,Crisco (shortening);egg;sugar;salt;vanilla;flour;nan;nan;nan;nan;nan;nan;nan;nan;nan;nan;nan;nan;nan,"['Crisco', '(', 'shortening', ')', ';', 'egg', ';', 'sugar', ';', 'salt', ';', 'vanilla', ';', 'flour', ';', 'nan', ';', 'nan', ';', 'nan', ';', 'nan', ';', 'nan', ';', 'nan', ';', 'nan', ';', 'nan', ';', 'nan', ';', 'nan', ';', 'nan', ';', 'nan', ';', 'nan']","['sugar', 'flour']"
Walnut Squares,"Cream butter and sugar. Beat in egg yolk. Sift four and spice, add to creamed mixture. Spread dough in 15""x10""x1"" jelly roll pan. Press flat with hands. Beat egg white slightly, brush on dough. Sprinkle nuts on top and press into dough. Bake in 250 degree oven for 1 hour. While hot cut into 1 1/2"" squares. Cool. Makes about 70.",1,cup,margarine,1,cup,sugar,1,nan,egg,2,cups,flour, 1/3,tsp,nutmeg,1,cups,"nuts, chopped",nan,nan,nan,nan,nan,nan,nan,nan,nan,nan,nan,nan,nan,nan,nan,nan,nan,nan,nan,nan,nan,nan,nan,nan,nan,nan,nan,nan,nan,nan,nan,nan,nan,nan,nan,nan,nan,nan,nan,cookies,"margarine;sugar;egg;flour;nutmeg;nuts, chopped;nan;nan;nan;nan;nan;nan;nan;nan;nan;nan;nan;nan;nan","['margarine', ';', 'sugar', ';', 'egg', ';', 'flour', ';', 'nutmeg', ';', 'nuts', ',', 'chopped', ';', 'nan', ';', 'nan', ';', 'nan', ';', 'nan', ';', 'nan', ';', 'nan', ';', 'nan', ';', 'nan', ';', 'nan', ';', 'nan', ';', 'nan', ';', 'nan', ';', 'nan']","['sugar', 'flour']"
Banana Cream Pie,"In a heavy saucepan dissolve cornstarch inwater; stir in sweetened condensed milk and egg yolks. Cook and stir until thickened and bubbly. Remove from heat; add margarine and vanilla. Cool slightly. Slice 2 bananas; dip in lemon juice and drain. Arrange on bottom of prepare crust. Pour filling over bananas; cover. Chill 4 hours or until set. Spread top with whipped cream. Slice remaining bananas; dip in lemon juice, drain and garnish top of pie. Refrigerate leftovers.",1,nan,baked pastry shell,3,Tbsp,cornstarch,1 2/3,cups,water,1,14 oz can,sweetened condensed milk,3,nan,"egg yolks, beaten",2,Tbsp, margarine or butter,1,tsp,vanilla,3,medium,bananas,nan,nan,lemon juice from concentrate,nan,nan,whipped cream,nan,nan,nan,nan,nan,nan,nan,nan,nan,nan,nan,nan,nan,nan,nan,nan,nan,nan,nan,nan,nan,nan,nan,nan,nan,nan,nan,pies,"baked pastry shell;cornstarch;water;sweetened condensed milk;egg yolks, beaten; margarine or butter;vanilla;bananas;lemon juice from concentrate;whipped cream;nan;nan;nan;nan;nan;nan;nan;nan;nan","['baked', 'pastry', 'shell', ';', 'cornstarch', ';', 'water', ';', 'sweetened', 'condensed', 'milk', ';', 'egg', 'yolks', ',', 'beaten', ';', 'margarine', 'or', 'butter', ';', 'vanilla', ';', 'bananas', ';', 'lemon', 'juice', 'from', 'concentrate', ';', 'whipped', 'cream', ';', 'nan', ';', 'nan', ';', 'nan', ';', 'nan', ';', 'nan', ';', 'nan', ';', 'nan', ';', 'nan', ';', 'nan']",['milk']
Blackberry Nectarine Pie,nan,2,cups,blackberries, 3/4,cups,sugar,2,Tbsp,cornstarch,1,cup,water,2 1/2,cups,"nectarines, sliced",1,nan,baked pie shell,nan,nan,whipped cream,nan,nan,nan,nan,nan,nan,nan,nan,nan,nan,nan,nan,nan,nan,nan,nan,nan,nan,nan,nan,nan,nan,nan,nan,nan,nan,nan,nan,nan,nan,nan,nan,nan,nan,nan,nan,pies,"blackberries;sugar;cornstarch;water;nectarines, sliced;baked pie shell;whipped cream;nan;nan;nan;nan;nan;nan;nan;nan;nan;nan;nan;nan","['blackberries', ';', 'sugar', ';', 'cornstarch', ';', 'water', ';', 'nectarines', ',', 'sliced', ';', 'baked', 'pie', 'shell', ';', 'whipped', 'cream', ';', 'nan', ';', 'nan', ';', 'nan', ';', 'nan', ';', 'nan', ';', 'nan', ';', 'nan', ';', 'nan', ';', 'nan', ';', 'nan', ';', 'nan', ';', 'nan']",['sugar']
Creamy Apple Pie,"Place apples in the pie shell. Mix together sugar, flour, and salt. Sprinkle over apples. in a sauce pan bring cream to boiling point. Pour over apples. Sprinkle generously with cinnamon. Bake at 375 degrees for 45 minutes, until firm.",1,9 inch,"pie shell, unbaked",4 or 5,nan,"tart apples, peeled and sliced",1,cup,sugar, 1/4,cup,flour, 1/2,tsp,salt,1,cup,heavy cream,nan,nan,cinnamon,nan,nan,nan,nan,nan,nan,nan,nan,nan,nan,nan,nan,nan,nan,nan,nan,nan,nan,nan,nan,nan,nan,nan,nan,nan,nan,nan,nan,nan,nan,nan,nan,nan,nan,nan,nan,pies,"pie shell, unbaked;tart apples, peeled and sliced;sugar;flour;salt;heavy cream;cinnamon;nan;nan;nan;nan;nan;nan;nan;nan;nan;nan;nan;nan","['pie', 'shell', ',', 'unbaked', ';', 'tart', 'apples', ',', 'peeled', 'and', 'sliced', ';', 'sugar', ';', 'flour', ';', 'salt', ';', 'heavy', 'cream', ';', 'cinnamon', ';', 'nan', ';', 'nan', ';', 'nan', ';', 'nan', ';', 'nan', ';', 'nan', ';', 'nan', ';', 'nan', ';', 'nan', ';', 'nan', ';', 'nan', ';', 'nan']","['sugar', 'flour', 'apples']"
Dutch Apple Pie,"Combine apples, 1/2 cup sugar, and cinnamon. Put into the unbaked pie shell. Top with 1/2 cup sugar, flour, butter, and cinnamon. Bake 45-50 minutes at 350 degrees.",4,nan,"large apples, sliced",1,cup ,sugar,1,tsp,cinnamon, 3/4,cup ,flour, 1/3,cup ,butter, 1/2,tsp,cinnamon,nan,nan,nan,nan,nan,nan,nan,nan,nan,nan,nan,nan,nan,nan,nan,nan,nan,nan,nan,nan,nan,nan,nan,nan,nan,nan,nan,nan,nan,nan,nan,nan,nan,nan,nan,nan,nan,nan,nan,pies,"large apples, sliced;sugar;cinnamon;flour;butter;cinnamon;nan;nan;nan;nan;nan;nan;nan;nan;nan;nan;nan;nan;nan","['large', 'apples', ',', 'sliced', ';', 'sugar', ';', 'cinnamon', ';', 'flour', ';', 'butter', ';', 'cinnamon', ';', 'nan', ';', 'nan', ';', 'nan', ';', 'nan', ';', 'nan', ';', 'nan', ';', 'nan', ';', 'nan', ';', 'nan', ';', 'nan', ';', 'nan', ';', 'nan', ';', 'nan']","['sugar', 'flour', 'apples']"
Fresh Strawberry Pie,Slice 1 basket of strawberries. Put half the berries in the bottom of a baked pie shell. Prepare glaze by combining remaining ingredients and cooking in a double-boiler until thickened.  Stir the other half of the berries into the glaze. Pour into the shell. Cool. Top with whipped cream and halved berries.,2,Tbsp,cornstarch,1,cup ,sugar,1 1/4,cups,water,a few,drops,red food coloring,1,Tbsp,butter,1,tsp,lemon juice,1,basket,strawberries,1,nan,"pie shell, baked",nan,nan,nan,nan,nan,nan,nan,nan,nan,nan,nan,nan,nan,nan,nan,nan,nan,nan,nan,nan,nan,nan,nan,nan,nan,nan,nan,nan,nan,nan,nan,nan,nan,pies,"cornstarch;sugar;water;red food coloring;butter;lemon juice;strawberries;pie shell, baked;nan;nan;nan;nan;nan;nan;nan;nan;nan;nan;nan","['cornstarch', ';', 'sugar', ';', 'water', ';', 'red', 'food', 'coloring', ';', 'butter', ';', 'lemon', 'juice', ';', 'strawberries', ';', 'pie', 'shell', ',', 'baked', ';', 'nan', ';', 'nan', ';', 'nan', ';', 'nan', ';', 'nan', ';', 'nan', ';', 'nan', ';', 'nan', ';', 'nan', ';', 'nan', ';', 'nan']",['sugar']
Lemon Cloud Pie,"Combine in sauce pan 3/4 cup sugar, cornstarch, water, lemon rind, and juice, and slightly beaten egg yolk. Cook over medium heat stirring constantly until thick. Remove from heat. Add softened cheese, blend well. Cool. Beat egg whites until stiff. Add 1/4 sugar. Fold into lemon mixture. Spoon into crust. Chill 2 hours. Serve with whipped cream.",1,cup,sugar, 1/2,cup,cornstarch,1,cup,water,1,tsp,"lemon rind, grated", 1/3,cup,lemon juice,2,nan,eggs,4,ounces,cream cheese,nan,nan,graham cracker crust,nan,nan,nan,nan,nan,nan,nan,nan,nan,nan,nan,nan,nan,nan,nan,nan,nan,nan,nan,nan,nan,nan,nan,nan,nan,nan,nan,nan,nan,nan,nan,nan,nan,pies,"sugar;cornstarch;water;lemon rind, grated;lemon juice;eggs;cream cheese;graham cracker crust;nan;nan;nan;nan;nan;nan;nan;nan;nan;nan;nan","['sugar', ';', 'cornstarch', ';', 'water', ';', 'lemon', 'rind', ',', 'grated', ';', 'lemon', 'juice', ';', 'eggs', ';', 'cream', 'cheese', ';', 'graham', 'cracker', 'crust', ';', 'nan', ';', 'nan', ';', 'nan', ';', 'nan', ';', 'nan', ';', 'nan', ';', 'nan', ';', 'nan', ';', 'nan', ';', 'nan', ';', 'nan']","['sugar', 'eggs', 'graham']"
Lemon Luscious Pie,"Combine sugar, cornstarch, butter, lemon rind, and egg yolk in saucepan. Stir in milk. Cook over medium heat, stirring until mixture thickens. Cool. Fold in sour cream. Spoon into pie shell. Col 12 hours or longer. Top with whipped cream. Garnish with chopped walnuts if desired.",1,cup,sugar,3,Tbsp,cornstarch, 1/4,cup,butter,1,Tbsp,"lemon rind, grated", 1/4,cup,lemon juice,3,nan,"egg yolks, slightly beaten",1,cup,milk,1,cup,sour cream,1,"8""",pie shell,nan,nan,nan,nan,nan,nan,nan,nan,nan,nan,nan,nan,nan,nan,nan,nan,nan,nan,nan,nan,nan,nan,nan,nan,nan,nan,nan,nan,nan,nan,pies,"sugar;cornstarch;butter;lemon rind, grated;lemon juice;egg yolks, slightly beaten;milk;sour cream;pie shell;nan;nan;nan;nan;nan;nan;nan;nan;nan;nan","['sugar', ';', 'cornstarch', ';', 'butter', ';', 'lemon', 'rind', ',', 'grated', ';', 'lemon', 'juice', ';', 'egg', 'yolks', ',', 'slightly', 'beaten', ';', 'milk', ';', 'sour', 'cream', ';', 'pie', 'shell', ';', 'nan', ';', 'nan', ';', 'nan', ';', 'nan', ';', 'nan', ';', 'nan', ';', 'nan', ';', 'nan', ';', 'nan', ';', 'nan']","['sugar', 'milk']"
Lemon Meringue Pie,"Mix sugar, cornstarch, and salt in top of double boiler. Place over boiling water and add remaining ingredients. Cook until thick, stirring with whip. Put into baked pie shell. Top with meringue. To make meringue whip 3 egg whites until stiff. Add 1/4 cup sugar. Brown 5 to 10 minutes in 400 degree oven. Chill.",1,cup,sugar,4,Tbsp,cornstarch, 1/2,tsp,salt,2,cups,hot water, 1/3,cup,"lemon juice, fresh or bottled",1,tsp,grated lemon juice,3,nan,egg yolks,1,Tbsp,butter,3,nan,egg whites, 1/4,cup,sugar,nan,nan,nan,nan,nan,nan,nan,nan,nan,nan,nan,nan,nan,nan,nan,nan,nan,nan,nan,nan,nan,nan,nan,nan,nan,nan,nan,pies,"sugar;cornstarch;salt;hot water;lemon juice, fresh or bottled;grated lemon juice;egg yolks;butter;egg whites;sugar;nan;nan;nan;nan;nan;nan;nan;nan;nan","['sugar', ';', 'cornstarch', ';', 'salt', ';', 'hot', 'water', ';', 'lemon', 'juice', ',', 'fresh', 'or', 'bottled', ';', 'grated', 'lemon', 'juice', ';', 'egg', 'yolks', ';', 'butter', ';', 'egg', 'whites', ';', 'sugar', ';', 'nan', ';', 'nan', ';', 'nan', ';', 'nan', ';', 'nan', ';', 'nan', ';', 'nan', ';', 'nan', ';', 'nan']",['sugar']
Old Fashioned Apple Pie,Combine first 4 ingredients. Put in unbaked pie shell. Slice butter on top. Cover with top crust. Bake at 350 degrees for 1 hour.,5,apples,sliced,1,cup,sugar, 1/4,tsp,cinnamon, 1/2,cup,water,1,Tbsp,butter,nan,nan,nan,nan,nan,nan,nan,nan,nan,nan,nan,nan,nan,nan,nan,nan,nan,nan,nan,nan,nan,nan,nan,nan,nan,nan,nan,nan,nan,nan,nan,nan,nan,nan,nan,nan,nan,nan,nan,nan,nan,nan,pies,sliced;sugar;cinnamon;water;butter;nan;nan;nan;nan;nan;nan;nan;nan;nan;nan;nan;nan;nan;nan,"['sliced', ';', 'sugar', ';', 'cinnamon', ';', 'water', ';', 'butter', ';', 'nan', ';', 'nan', ';', 'nan', ';', 'nan', ';', 'nan', ';', 'nan', ';', 'nan', ';', 'nan', ';', 'nan', ';', 'nan', ';', 'nan', ';', 'nan', ';', 'nan', ';', 'nan']",['sugar']
Peach Almond Pie,"Sprinkle peaches with lemon and sugar. Let stand 1 hour. Drain to get 1 cup syrup. Add cornstarch to syrup and blend. Cook over low heat until thick. Remove from heat. Add butter, salt, and almond extract. Cool. Carefully stir in peaches. Put in shell. Chill. Serve with whipped cream, topped with slivered almonds and marachino cherries.",2,cups,"fresh peaches, sliced",1,Tbsp,lemon juice, 1/4,cup,sugar,3,Tbsp,cornstarch,2,tsp,butter,nan,dash,salt, 1/4,tsp,almond extract,1,9 inch,pie shell,nan,nan,nan,nan,nan,nan,nan,nan,nan,nan,nan,nan,nan,nan,nan,nan,nan,nan,nan,nan,nan,nan,nan,nan,nan,nan,nan,nan,nan,nan,nan,nan,nan,pies,"fresh peaches, sliced;lemon juice;sugar;cornstarch;butter;salt;almond extract;pie shell;nan;nan;nan;nan;nan;nan;nan;nan;nan;nan;nan","['fresh', 'peaches', ',', 'sliced', ';', 'lemon', 'juice', ';', 'sugar', ';', 'cornstarch', ';', 'butter', ';', 'salt', ';', 'almond', 'extract', ';', 'pie', 'shell', ';', 'nan', ';', 'nan', ';', 'nan', ';', 'nan', ';', 'nan', ';', 'nan', ';', 'nan', ';', 'nan', ';', 'nan', ';', 'nan', ';', 'nan']",['sugar']
Peach Parfait Pie,Dissolve gelatin in hot water. At once add 1/4 of ice cream and stir until blended. Repeat until all of ice cream is added. Chill until almost firm. Mix peaches with sugar and fold into mixture. Pour into baked shell and chill unit firm. Whip cream and spread on pie.,1,3 ounce box,peach or lemon gelatin,1 1/4,cups,hot water,1,pint,Peach or vanilla ice cream,2,nan,"fresh peaches, peeled and diced", 1/4,cup,sugar,1,nan,"baked pie shell, chilled", 1/2,cup,heavy cream,nan,nan,nan,nan,nan,nan,nan,nan,nan,nan,nan,nan,nan,nan,nan,nan,nan,nan,nan,nan,nan,nan,nan,nan,nan,nan,nan,nan,nan,nan,nan,nan,nan,nan,nan,nan,pies,"peach or lemon gelatin;hot water;Peach or vanilla ice cream;fresh peaches, peeled and diced;sugar;baked pie shell, chilled;heavy cream;nan;nan;nan;nan;nan;nan;nan;nan;nan;nan;nan;nan","['peach', 'or', 'lemon', 'gelatin', ';', 'hot', 'water', ';', 'Peach', 'or', 'vanilla', 'ice', 'cream', ';', 'fresh', 'peaches', ',', 'peeled', 'and', 'diced', ';', 'sugar', ';', 'baked', 'pie', 'shell', ',', 'chilled', ';', 'heavy', 'cream', ';', 'nan', ';', 'nan', ';', 'nan', ';', 'nan', ';', 'nan', ';', 'nan', ';', 'nan', ';', 'nan', ';', 'nan', ';', 'nan', ';', 'nan', ';', 'nan']",['sugar']
Peanut Butter Ice Cream Pie,"Mix graham cracker crumbs, sugar, and melted margarine. Press into 9"" pie pan. Chill. To make filling whip 1/2 cup whipping cream. Place ice cream in a bowl and stir to soften. Fold in peanut butter; then fold in whipped cream. Spoon mixture into crust. Freeze about 5 hours. Remove from freezer about 15 minutes before serving.",1 1/2,cups,"graham cracker crumbs, 18 squares", 1/4,cup,sugar, 1/2,cup,"margarine, melted", 1/2,cup,whipped cream or cool whip,1,quart,vanilla ice cream, 1/2,cup,chunk style peanut buter,nan,nan,nan,nan,nan,nan,nan,nan,nan,nan,nan,nan,nan,nan,nan,nan,nan,nan,nan,nan,nan,nan,nan,nan,nan,nan,nan,nan,nan,nan,nan,nan,nan,nan,nan,nan,nan,nan,nan,pies,"graham cracker crumbs, 18 squares;sugar;margarine, melted;whipped cream or cool whip;vanilla ice cream;chunk style peanut buter;nan;nan;nan;nan;nan;nan;nan;nan;nan;nan;nan;nan;nan","['graham', 'cracker', 'crumbs', ',', '18', 'squares', ';', 'sugar', ';', 'margarine', ',', 'melted', ';', 'whipped', 'cream', 'or', 'cool', 'whip', ';', 'vanilla', 'ice', 'cream', ';', 'chunk', 'style', 'peanut', 'buter', ';', 'nan', ';', 'nan', ';', 'nan', ';', 'nan', ';', 'nan', ';', 'nan', ';', 'nan', ';', 'nan', ';', 'nan', ';', 'nan', ';', 'nan', ';', 'nan', ';', 'nan']","['graham', 'sugar']"
Peanut Butter Pie,Combine first 5 ingredients. Mix thoroughly. Pour into pie shell. Bake at 350 degrees for 15 minutes. Reduce heat to 350 degrees and bake for 30 to 35 minutes. It should appear less set in the center. Chill. Top with whipped cream.,1,cup,light or dark corn syrup,1,cup,sugar,3,nan,"eggs, slightly beaten", 1/2,tsp,vanilla, 1/3,cup,chunk style peanut butter,1,nan,"pie shell, unbaked",1,cup,whipped cream,nan,nan,nan,nan,nan,nan,nan,nan,nan,nan,nan,nan,nan,nan,nan,nan,nan,nan,nan,nan,nan,nan,nan,nan,nan,nan,nan,nan,nan,nan,nan,nan,nan,nan,nan,nan,pies,"light or dark corn syrup;sugar;eggs, slightly beaten;vanilla;chunk style peanut butter;pie shell, unbaked;whipped cream;nan;nan;nan;nan;nan;nan;nan;nan;nan;nan;nan;nan","['light', 'or', 'dark', 'corn', 'syrup', ';', 'sugar', ';', 'eggs', ',', 'slightly', 'beaten', ';', 'vanilla', ';', 'chunk', 'style', 'peanut', 'butter', ';', 'pie', 'shell', ',', 'unbaked', ';', 'whipped', 'cream', ';', 'nan', ';', 'nan', ';', 'nan', ';', 'nan', ';', 'nan', ';', 'nan', ';', 'nan', ';', 'nan', ';', 'nan', ';', 'nan', ';', 'nan', ';', 'nan']","['sugar', 'eggs']"
Pie Crust,"Mix flour, salt, and shortening. Stir in water enough to bind mixture together to form soft dough. Makes two 9"" pie crusts or 1 double crust. For double crust pie bake at 350 degrees for 1 hour. For pie shell bake at 400 degrees for 10 minutes.",2,cups,sifted flour, 1/2,tsp,salt, 2/3,cup,shortening,4 or 5,Tbsp,ice water or 7-up,nan,nan,nan,nan,nan,nan,nan,nan,nan,nan,nan,nan,nan,nan,nan,nan,nan,nan,nan,nan,nan,nan,nan,nan,nan,nan,nan,nan,nan,nan,nan,nan,nan,nan,nan,nan,nan,nan,nan,nan,nan,nan,nan,nan,nan,pies,sifted flour;salt;shortening;ice water or 7-up;nan;nan;nan;nan;nan;nan;nan;nan;nan;nan;nan;nan;nan;nan;nan,"['sifted', 'flour', ';', 'salt', ';', 'shortening', ';', 'ice', 'water', 'or', '7-up', ';', 'nan', ';', 'nan', ';', 'nan', ';', 'nan', ';', 'nan', ';', 'nan', ';', 'nan', ';', 'nan', ';', 'nan', ';', 'nan', ';', 'nan', ';', 'nan', ';', 'nan', ';', 'nan', ';', 'nan']",['flour']
Sour Cream Raisin Pie,"Boil raisins in water until plump. Add flour and sugar. Cook to thicken slightly then add egg yolks, sour cream, vanilla and nutmeg. Pour into 9"" bottom crust. Add top crust. Sprinkle with sugar. Bake 50 minutes at 350 degrees.",1 1/2,cups,raisins,1 1/2,cups,water,1 1/2,Tbsp,flour, 3/4,cup,sugar,3,nan,"egg yolks, slightly beaten",1,cup,sour cream,1,tsp,vanilla, 1/2,tsp,nutmeg,nan,nan,nan,nan,nan,nan,nan,nan,nan,nan,nan,nan,nan,nan,nan,nan,nan,nan,nan,nan,nan,nan,nan,nan,nan,nan,nan,nan,nan,nan,nan,nan,nan,pies,"raisins;water;flour;sugar;egg yolks, slightly beaten;sour cream;vanilla;nutmeg;nan;nan;nan;nan;nan;nan;nan;nan;nan;nan;nan","['raisins', ';', 'water', ';', 'flour', ';', 'sugar', ';', 'egg', 'yolks', ',', 'slightly', 'beaten', ';', 'sour', 'cream', ';', 'vanilla', ';', 'nutmeg', ';', 'nan', ';', 'nan', ';', 'nan', ';', 'nan', ';', 'nan', ';', 'nan', ';', 'nan', ';', 'nan', ';', 'nan', ';', 'nan', ';', 'nan']","['sugar', 'flour']"
Walnut Pie,Mix well. Pour into unbaked pie shell. Top with 1 cup walnuts or pecans. Bake at 350 degrees for 1 hour., 3/4,cup,sugar, 3/4,cup,light corn syrup,3,nan,eggs,1,cup,evaporated milk,1,tsp,vanilla,2,Tbsp,flour, 1/4,tsp,nutmeg,nan,nan,nan,nan,nan,nan,nan,nan,nan,nan,nan,nan,nan,nan,nan,nan,nan,nan,nan,nan,nan,nan,nan,nan,nan,nan,nan,nan,nan,nan,nan,nan,nan,nan,nan,nan,pies,sugar;light corn syrup;eggs;evaporated milk;vanilla;flour;nutmeg;nan;nan;nan;nan;nan;nan;nan;nan;nan;nan;nan;nan,"['sugar', ';', 'light', 'corn', 'syrup', ';', 'eggs', ';', 'evaporated', 'milk', ';', 'vanilla', ';', 'flour', ';', 'nutmeg', ';', 'nan', ';', 'nan', ';', 'nan', ';', 'nan', ';', 'nan', ';', 'nan', ';', 'nan', ';', 'nan', ';', 'nan', ';', 'nan', ';', 'nan', ';', 'nan']","['sugar', 'flour', 'milk', 'eggs']"
Walnut-Raisin pie,"Mix sugar and butter. Add eggs one at a time, beating after each is added. Add raisins nuts, and vanilla. Pour into unbaked pie shell. Bake at 400 degrees for 10 minutes. Reduce heat to 375 degrees for 30 minutes.", 3/4,cup,sugar,3,nan,eggs,1,cup,"walnuts, chopped", 1/2,cup,butter,1,tsp,vanilla,1,cup,raisins,nan,nan,nan,nan,nan,nan,nan,nan,nan,nan,nan,nan,nan,nan,nan,nan,nan,nan,nan,nan,nan,nan,nan,nan,nan,nan,nan,nan,nan,nan,nan,nan,nan,nan,nan,nan,nan,nan,nan,pies,"sugar;eggs;walnuts, chopped;butter;vanilla;raisins;nan;nan;nan;nan;nan;nan;nan;nan;nan;nan;nan;nan;nan","['sugar', ';', 'eggs', ';', 'walnuts', ',', 'chopped', ';', 'butter', ';', 'vanilla', ';', 'raisins', ';', 'nan', ';', 'nan', ';', 'nan', ';', 'nan', ';', 'nan', ';', 'nan', ';', 'nan', ';', 'nan', ';', 'nan', ';', 'nan', ';', 'nan', ';', 'nan', ';', 'nan']","['sugar', 'eggs']"
