Title,Directions,Quantity,Unit01,Ingredient01,Quantity02,Unit02,Ingredient02,Quantity03,Unit03,Ingredient03,Quantity04,Unit04,Ingredient04,Quantity05,Unit05,Ingredient05,Quantity06,Unit06,Ingredient06,Quantity07,Unit07,Ingredient07,Quantity08,Unit08,Ingredient08,Quantity09,Unit09,Ingredient09,Quantity10,Unit10,Ingredient10,Quantity11,Unit11,Ingredient11,Quantity12,Unit12,Ingredient12,Quantity13,Unit13,Ingredient13,Quantity14,Unit14,Ingredient14,Quantity15,Unit15,Ingredient15,Quantity16,Unit16,Ingredient16,Quantity17,Unit17,Ingredient17,Quantity18,Unit18,Ingredient18,Quantity19,Unit19,Ingredient19,Category,ingredients,tokenized_ingr,ingr_json
Eggplant Rollatini,"Heat broiler pan 4 inches from heat. In a small bowl, beat egg slightly with a fork; stir in ricotta, all but 1 tablespoon provolone, 2 tablespoons parsley and pepper and mix well. Set aside.SLice eggplant into 12 lengthwise slices. Arrange in single layer on broiler pan; brush with vinaigrette. Broil 3 to 4 minutes until speckled with brown. Turn slices, brush with vinaigrette; broil 3 to 4 minutes until brown and 10der.Adjust oven to 400 degrees. Spoon marinara over bottom of a 10 inch round shallow baking dish. Set aside.Place broiled eggplant slices on work surface. Spread each with 2 tablespoons of the filling and sprinkle with 1/4 teaspoon of basil. Roll slices; jelly roll style. Dip each in sauce in baking dish to coat. Place seam side down. Cover in marinara. Cover with foil. Bake for 35 minutes. Sprinkle with reserved mozzarella and fresh parsley.",1,large,"egg, seperated", 3/4,cup,ricotta cheese, 1/2,cup,"mozzarella or provol1, coarsely grated",2,tbsps,"fresh parsley, chopped", 1/4,tsp,pepper,1,large,eggplant, 1/4,cup,red wine vinaigrette,1,cup,marinara sauce,1,tbsp,dried basil,nan,nan,nan,nan,nan,nan,nan,nan,nan,nan,nan,nan,nan,nan,nan,nan,nan,nan,nan,nan,nan,nan,nan,nan,nan,nan,nan,nan,nan,nan,asian food,"egg, seperated;ricotta cheese;mozzarella or provol1, coarsely grated;fresh parsley, chopped;pepper;eggplant;red wine vinaigrette;marinara sauce;dried basil;nan;nan;nan;nan;nan;nan;nan;nan;nan;nan","['egg', ',', 'seperated', ';', 'ricotta', 'cheese', ';', 'mozzarella', 'or', 'provol1', ',', 'coarsely', 'grated', ';', 'fresh', 'parsley', ',', 'chopped', ';', 'pepper', ';', 'eggplant', ';', 'red', 'wine', 'vinaigrette', ';', 'marinara', 'sauce', ';', 'dried', 'basil', ';', 'nan', ';', 'nan', ';', 'nan', ';', 'nan', ';', 'nan', ';', 'nan', ';', 'nan', ';', 'nan', ';', 'nan', ';', 'nan']",[]
Glazed Carrots,"Cut carrots in strips or rounds. Boil with butter, sugar and water to almost covered. Cook to fork tender. Stir in orange marmalade.",nan,nan,carrots, 1/4,cup,butter, 1/2,cup,powdered sugar,nan,nan,water,1,large,spoonful of orange marmalade,nan,nan,nan,nan,nan,nan,nan,nan,nan,nan,nan,nan,nan,nan,nan,nan,nan,nan,nan,nan,nan,nan,nan,nan,nan,nan,nan,nan,nan,nan,nan,nan,nan,nan,nan,nan,nan,nan,nan,nan,nan,nan,asian food,carrots;butter;powdered sugar;water;spoonful of orange marmalade;nan;nan;nan;nan;nan;nan;nan;nan;nan;nan;nan;nan;nan;nan,"['carrots', ';', 'butter', ';', 'powdered', 'sugar', ';', 'water', ';', 'spoonful', 'of', 'orange', 'marmalade', ';', 'nan', ';', 'nan', ';', 'nan', ';', 'nan', ';', 'nan', ';', 'nan', ';', 'nan', ';', 'nan', ';', 'nan', ';', 'nan', ';', 'nan', ';', 'nan', ';', 'nan', ';', 'nan']",['sugar']
Green Beans Salerno,"Combine salad oil, vinegar and spaghetti sauce mix. Pour over drained beans. Chill.Before serving, toss beans with shredded lettuce and crumbled bacon.",1,cup,salad oil, 1/2,cup,vinegar,1,pkg,package of dry spaghetti sauce mix,2,cans,"green beans, dried",2,cups,shredded lettuce,6,slices,"crisp bacon, crumbled",nan,nan,nan,nan,nan,nan,nan,nan,nan,nan,nan,nan,nan,nan,nan,nan,nan,nan,nan,nan,nan,nan,nan,nan,nan,nan,nan,nan,nan,nan,nan,nan,nan,nan,nan,nan,nan,nan,nan,asian food,"salad oil;vinegar;package of dry spaghetti sauce mix;green beans, dried;shredded lettuce;crisp bacon, crumbled;nan;nan;nan;nan;nan;nan;nan;nan;nan;nan;nan;nan;nan","['salad', 'oil', ';', 'vinegar', ';', 'package', 'of', 'dry', 'spaghetti', 'sauce', 'mix', ';', 'green', 'beans', ',', 'dried', ';', 'shredded', 'lettuce', ';', 'crisp', 'bacon', ',', 'crumbled', ';', 'nan', ';', 'nan', ';', 'nan', ';', 'nan', ';', 'nan', ';', 'nan', ';', 'nan', ';', 'nan', ';', 'nan', ';', 'nan', ';', 'nan', ';', 'nan', ';', 'nan']",[]
Italian Zucchini,"Cut zucchini in thick slices. Saute onion and garlic in oil. Add squash, mushrooms, and seasonings. Simmer slowly until tender.",5 or 6,nan,zucchini,nan,nan,salad oil,nan,nan,garlic,nan,nan,onion,nan,nan,mushrooms,nan,nan,rosemary,nan,nan,salt,nan,nan,pepper,nan,nan,"parsely, chopped",nan,nan,thyme,nan,nan,savory salt,nan,nan,nan,nan,nan,nan,nan,nan,nan,nan,nan,nan,nan,nan,nan,nan,nan,nan,nan,nan,nan,nan,nan,nan,asian food,"zucchini;salad oil;garlic;onion;mushrooms;rosemary;salt;pepper;parsely, chopped;thyme;savory salt;nan;nan;nan;nan;nan;nan;nan;nan","['zucchini', ';', 'salad', 'oil', ';', 'garlic', ';', 'onion', ';', 'mushrooms', ';', 'rosemary', ';', 'salt', ';', 'pepper', ';', 'parsely', ',', 'chopped', ';', 'thyme', ';', 'savory', 'salt', ';', 'nan', ';', 'nan', ';', 'nan', ';', 'nan', ';', 'nan', ';', 'nan', ';', 'nan', ';', 'nan']",[]
Mushrooms in Sour Cream,"In skillet, fry bacon until crisp. Drain on paper towel. Add onion and mushrooms. Saute 10 minutes on low heat. Stir in flour. Add cream and worcestershire sauce. Cook on low, stirring constantly. Spoon over toast. Sprinkle bacon on top.",8,slices,"bacon, cut up", 1/2,cup,"onion, minced",1,pound,"fresh mushrooms, sliced",1,tsp,flour,1,cup,sour cream,1,tsp,worcestershire sauce,nan,nan,toast slices,nan,nan,nan,nan,nan,nan,nan,nan,nan,nan,nan,nan,nan,nan,nan,nan,nan,nan,nan,nan,nan,nan,nan,nan,nan,nan,nan,nan,nan,nan,nan,nan,nan,nan,nan,nan,asian food,"bacon, cut up;onion, minced;fresh mushrooms, sliced;flour;sour cream;worcestershire sauce;toast slices;nan;nan;nan;nan;nan;nan;nan;nan;nan;nan;nan;nan","['bacon', ',', 'cut', 'up', ';', 'onion', ',', 'minced', ';', 'fresh', 'mushrooms', ',', 'sliced', ';', 'flour', ';', 'sour', 'cream', ';', 'worcestershire', 'sauce', ';', 'toast', 'slices', ';', 'nan', ';', 'nan', ';', 'nan', ';', 'nan', ';', 'nan', ';', 'nan', ';', 'nan', ';', 'nan', ';', 'nan', ';', 'nan', ';', 'nan', ';', 'nan']",['flour']
Orange Sweet Potatoes,"Peel and cut potatoes into 1/2 inch slices. Put potatoes in a large pot of water, butter and sugar. Boil to fork tender. Do not overcook. Save liquid.Gently remove potatoes and layer in a 9x13 inch baking dish. Top with orange slices. Cook liquid down until syrupy. Pour over potatoes. Sprinkle with cinnamon.Bake at 350 degrees for 30 to 40 minutes,",3,large,sweet potatoes,4,cups,water, 1/2,cup,butter,1,cup,powdered sugar,2,nan,"oranges, sliced thin",nan,nan,nan,nan,nan,nan,nan,nan,nan,nan,nan,nan,nan,nan,nan,nan,nan,nan,nan,nan,nan,nan,nan,nan,nan,nan,nan,nan,nan,nan,nan,nan,nan,nan,nan,nan,nan,nan,nan,nan,nan,nan,asian food,"sweet potatoes;water;butter;powdered sugar;oranges, sliced thin;nan;nan;nan;nan;nan;nan;nan;nan;nan;nan;nan;nan;nan;nan","['sweet', 'potatoes', ';', 'water', ';', 'butter', ';', 'powdered', 'sugar', ';', 'oranges', ',', 'sliced', 'thin', ';', 'nan', ';', 'nan', ';', 'nan', ';', 'nan', ';', 'nan', ';', 'nan', ';', 'nan', ';', 'nan', ';', 'nan', ';', 'nan', ';', 'nan', ';', 'nan', ';', 'nan', ';', 'nan']",['sugar']
Peas,Thicken liquid from peas and onions. Add other ingredients.,1,pkg,"frozen peas, cooked",1,can,small onions, 1/2,cup,sauterne wine,1,tsp,parsley flakes,nan,nan,salt,nan,nan,pepper,nan,nan,crisply fried bacon bits,nan,nan,nan,nan,nan,nan,nan,nan,nan,nan,nan,nan,nan,nan,nan,nan,nan,nan,nan,nan,nan,nan,nan,nan,nan,nan,nan,nan,nan,nan,nan,nan,nan,nan,nan,nan,asian food,"frozen peas, cooked;small onions;sauterne wine;parsley flakes;salt;pepper;crisply fried bacon bits;nan;nan;nan;nan;nan;nan;nan;nan;nan;nan;nan;nan","['frozen', 'peas', ',', 'cooked', ';', 'small', 'onions', ';', 'sauterne', 'wine', ';', 'parsley', 'flakes', ';', 'salt', ';', 'pepper', ';', 'crisply', 'fried', 'bacon', 'bits', ';', 'nan', ';', 'nan', ';', 'nan', ';', 'nan', ';', 'nan', ';', 'nan', ';', 'nan', ';', 'nan', ';', 'nan', ';', 'nan', ';', 'nan', ';', 'nan']",[]
Saute Zucchini,"Melt butter in skillet. Slice zucchini thin, Add garlic. Cover and simmer for 5 minutes. Sprinkle with parmesan cheese. Cover and cook 5 minutes longer.",2,small,zucchini,1,clove,"garlic, minced",2,tbsps,butter,nan,nan,parmesan cheese,nan,nan,nan,nan,nan,nan,nan,nan,nan,nan,nan,nan,nan,nan,nan,nan,nan,nan,nan,nan,nan,nan,nan,nan,nan,nan,nan,nan,nan,nan,nan,nan,nan,nan,nan,nan,nan,nan,nan,nan,nan,nan,nan,nan,nan,asian food,"zucchini;garlic, minced;butter;parmesan cheese;nan;nan;nan;nan;nan;nan;nan;nan;nan;nan;nan;nan;nan;nan;nan","['zucchini', ';', 'garlic', ',', 'minced', ';', 'butter', ';', 'parmesan', 'cheese', ';', 'nan', ';', 'nan', ';', 'nan', ';', 'nan', ';', 'nan', ';', 'nan', ';', 'nan', ';', 'nan', ';', 'nan', ';', 'nan', ';', 'nan', ';', 'nan', ';', 'nan', ';', 'nan', ';', 'nan']",[]
Spinach Pie,"Preheat oven to 350 degrees. Let pastry sheets warm to room temperature, according to directions on package. In 1/4 cup hot butter in medium skillet, saute onion until golden, about 5 minutes. Add spinach; stir to combine onion. Remove from heat.In a large bowl, beat eggs with rotary beater. With a wooden spoon, stir in cheese, parsely, dill, salt, pepper and spinach/onion mixture; mix well.Brush a 13x9x2 inch baking pan lightly with some of the melted butter. In bottom of baking pan, layer 8 phyllo pastry sheets 1 by 1, brushing top of each with some of melted butter. SPread evenly with spinach mixture. (Keep unused pastry sheets covered with damp paper towels to prevent drying out.)Cover with 8 more leaves, brushing each with butter; pour any remaining melted butter over the top. Using scissors, trim off any uneven edges of pastry. Cut through top pastry layer to form 18 rectangles, about 3 by 2 inches.Bake 30 to 35 minutes, or until top crust is puffy and golden. Serve warm.Makes 18 servings.",16,sheets,phyllo pastry, 1/4,cup,butter or margarine, 1/2,cup,"onion, finely chopped",30,ounces,"frozen chopped spinach, thawed and drained",3,nan,eggs, 1/2,pound,"feta cheese, crumbled", 1/4,cup,"parsley, chopped",2,tbsps,"fresh dill, chopped",1,tsp,salt, 1/8,tsp,pepper, 3/4,cup,"butter or margarine, melted",nan,nan,nan,nan,nan,nan,nan,nan,nan,nan,nan,nan,nan,nan,nan,nan,nan,nan,nan,nan,nan,nan,nan,nan,asian food,"phyllo pastry;butter or margarine;onion, finely chopped;frozen chopped spinach, thawed and drained;eggs;feta cheese, crumbled;parsley, chopped;fresh dill, chopped;salt;pepper;butter or margarine, melted;nan;nan;nan;nan;nan;nan;nan;nan","['phyllo', 'pastry', ';', 'butter', 'or', 'margarine', ';', 'onion', ',', 'finely', 'chopped', ';', 'frozen', 'chopped', 'spinach', ',', 'thawed', 'and', 'drained', ';', 'eggs', ';', 'feta', 'cheese', ',', 'crumbled', ';', 'parsley', ',', 'chopped', ';', 'fresh', 'dill', ',', 'chopped', ';', 'salt', ';', 'pepper', ';', 'butter', 'or', 'margarine', ',', 'melted', ';', 'nan', ';', 'nan', ';', 'nan', ';', 'nan', ';', 'nan', ';', 'nan', ';', 'nan', ';', 'nan']",['eggs']
Spinach Souffle,Make white sauce using first 5 ingredients. Remove from heat. Stir in 3 beaten egg yolks. Add spinach. Fold in 3 stiffly beaten egg whites. Pore into a buttered dish. Bake at 400 degrees for 25 minutes. Serve at once.,2,tbsps,"margarine, melted",2,tbsps,flour, 1/2,tsp,salt and pepper,1,tsp,worcestershire sauce, 3/4,cup,milk,3,nan,"eggs, seperated",1,cup,"spinach, cooked",nan,nan,nan,nan,nan,nan,nan,nan,nan,nan,nan,nan,nan,nan,nan,nan,nan,nan,nan,nan,nan,nan,nan,nan,nan,nan,nan,nan,nan,nan,nan,nan,nan,nan,nan,nan,asian food,"margarine, melted;flour;salt and pepper;worcestershire sauce;milk;eggs, seperated;spinach, cooked;nan;nan;nan;nan;nan;nan;nan;nan;nan;nan;nan;nan","['margarine', ',', 'melted', ';', 'flour', ';', 'salt', 'and', 'pepper', ';', 'worcestershire', 'sauce', ';', 'milk', ';', 'eggs', ',', 'seperated', ';', 'spinach', ',', 'cooked', ';', 'nan', ';', 'nan', ';', 'nan', ';', 'nan', ';', 'nan', ';', 'nan', ';', 'nan', ';', 'nan', ';', 'nan', ';', 'nan', ';', 'nan', ';', 'nan']","['flour', 'milk', 'eggs']"
Spinach Strudels,"Butter baking sheets. Steam spinach for 5 minutes. Squeeze out moisture. Melt 6 tablespoons of butter in a heavy skillet over medium heat. Add shallots, cook for 3 minutes. Add spinach and cook until dry, about 8 minutes. Transfer to large bowl. Mix in all cheeses. Arrange 1 phyllo sheet on kitchen towel. Brush with melted butter. Sprinkle with 1 tablespoon of crumbs, top with second sheet, butter and crumbs. Repeat with third, butter and crumbs, spread 1/6 of spinach mix down 1 long side of pastry, 2 inches from edge. Fold 2 inches over filling, then fold in sides. Roll up. Put seam side down on baking sheet. Repeat with remaining filling and phyllo. Cut each strudel into 4 slices,cutting only 1/3 through. Brush with butter.Bake at 350 degrees for 15 minutes. After brushing with egg increase to 400 degrees and bake for 5 minutes more. Cut rest of the way through. Arrange on platter with parsley sprigs.",3,pounds,"fresh spinach, stems removed",6,tbsp,unsalted butter,24,nan,"shallots, chopped",12,ounces,"gorgonzola cheese, crumbled",27,ounces,"cream cheese, sof10ed",24,nan,phyllo pastry sheets,1 1/2,cups,"unsalted butter, melted",18,tbsp,dry bread crumbs,2,nan,"eggs, bea10",nan,nan,parsley sprigs,nan,nan,nan,nan,nan,nan,nan,nan,nan,nan,nan,nan,nan,nan,nan,nan,nan,nan,nan,nan,nan,nan,nan,nan,nan,nan,nan,asian food,"fresh spinach, stems removed;unsalted butter;shallots, chopped;gorgonzola cheese, crumbled;cream cheese, sof10ed;phyllo pastry sheets;unsalted butter, melted;dry bread crumbs;eggs, bea10;parsley sprigs;nan;nan;nan;nan;nan;nan;nan;nan;nan","['fresh', 'spinach', ',', 'stems', 'removed', ';', 'unsalted', 'butter', ';', 'shallots', ',', 'chopped', ';', 'gorgonzola', 'cheese', ',', 'crumbled', ';', 'cream', 'cheese', ',', 'sof10ed', ';', 'phyllo', 'pastry', 'sheets', ';', 'unsalted', 'butter', ',', 'melted', ';', 'dry', 'bread', 'crumbs', ';', 'eggs', ',', 'bea10', ';', 'parsley', 'sprigs', ';', 'nan', ';', 'nan', ';', 'nan', ';', 'nan', ';', 'nan', ';', 'nan', ';', 'nan', ';', 'nan', ';', 'nan']",['eggs']
Stuffed Zucchini,Cook zucchini to fork tender. Slice lengthwise. Remove center pulp to bowl. Brown hambugrer or sausage with chopped onion. Mix with pulp. Add croutons that have been sof10ed in water boullion cube. Add spices to taste. Stir in 2 eggs. Mixture will be quite soft. Spoon into zucchini shells. Sprinkle with parmesan and melted butter or olive oil.Bake 1/2 hour at 350 degrees until filling is set.,3,6 inch,zucchini, 1/2,pound,hamburger or sausage,nan,nan,"onion, chopped",2,cups,croutons,1,nan,boullion cube,nan,nan,salt,nan,nan,pepper,nan,nan,garlic,nan,nan,thyme,nan,nan,oregano,nan,nan,sage,2,nan,eggs,nan,nan,parmesan cheese,nan,nan,melted butter or margarine,nan,nan,nan,nan,nan,nan,nan,nan,nan,nan,nan,nan,nan,nan,nan,asian food,"zucchini;hamburger or sausage;onion, chopped;croutons;boullion cube;salt;pepper;garlic;thyme;oregano;sage;eggs;parmesan cheese;melted butter or margarine;nan;nan;nan;nan;nan","['zucchini', ';', 'hamburger', 'or', 'sausage', ';', 'onion', ',', 'chopped', ';', 'croutons', ';', 'boullion', 'cube', ';', 'salt', ';', 'pepper', ';', 'garlic', ';', 'thyme', ';', 'oregano', ';', 'sage', ';', 'eggs', ';', 'parmesan', 'cheese', ';', 'melted', 'butter', 'or', 'margarine', ';', 'nan', ';', 'nan', ';', 'nan', ';', 'nan', ';', 'nan']",['eggs']
Summer Squash,"Boil squash until tender. Mash with butter, salt, pepper, worcestershire sauce, 2 eggs, cracker crumbs, onion and parmesan cheese. Put in casserole, top with paprika and bacon bits. Bake about 30 minutes.",nan,nan,summer squash,nan,nan,butter salt,nan,nan,pepper,nan,nan,worcestershire sauce,2,nan,eggs,nan,nan,cracker crumbs,1,small,"onion, grated", 1/2,cup,parmesan cheese,nan,nan,paprika,nan,nan,"bacon bits, crisply fried",nan,nan,nan,nan,nan,nan,nan,nan,nan,nan,nan,nan,nan,nan,nan,nan,nan,nan,nan,nan,nan,nan,nan,nan,nan,nan,nan,asian food,"summer squash;butter salt;pepper;worcestershire sauce;eggs;cracker crumbs;onion, grated;parmesan cheese;paprika;bacon bits, crisply fried;nan;nan;nan;nan;nan;nan;nan;nan;nan","['summer', 'squash', ';', 'butter', 'salt', ';', 'pepper', ';', 'worcestershire', 'sauce', ';', 'eggs', ';', 'cracker', 'crumbs', ';', 'onion', ',', 'grated', ';', 'parmesan', 'cheese', ';', 'paprika', ';', 'bacon', 'bits', ',', 'crisply', 'fried', ';', 'nan', ';', 'nan', ';', 'nan', ';', 'nan', ';', 'nan', ';', 'nan', ';', 'nan', ';', 'nan', ';', 'nan']",['eggs']
Sweet and Sour Red Cabbage,"Heat oil in skillet. add cabbage and apple. Combine rest of ingredients, pour over cabbage, Cover tightly. Cook over low heat, sit occasionally for 15-20 minutes, until tender.",3,tbsp,oil,6,cups,"red cabbage, shredded",3,cups,"unparred apple, cubed", 1/3,cup,brown sugar, 1/2,cup,vinegar, 1/3,cup,water,nan,nan,pepper, 3/4,tsp,caraway seed,nan,nan,nan,nan,nan,nan,nan,nan,nan,nan,nan,nan,nan,nan,nan,nan,nan,nan,nan,nan,nan,nan,nan,nan,nan,nan,nan,nan,nan,nan,nan,nan,nan,asian food,"oil;red cabbage, shredded;unparred apple, cubed;brown sugar;vinegar;water;pepper;caraway seed;nan;nan;nan;nan;nan;nan;nan;nan;nan;nan;nan","['oil', ';', 'red', 'cabbage', ',', 'shredded', ';', 'unparred', 'apple', ',', 'cubed', ';', 'brown', 'sugar', ';', 'vinegar', ';', 'water', ';', 'pepper', ';', 'caraway', 'seed', ';', 'nan', ';', 'nan', ';', 'nan', ';', 'nan', ';', 'nan', ';', 'nan', ';', 'nan', ';', 'nan', ';', 'nan', ';', 'nan', ';', 'nan']",['sugar']
The Spinach,"Thaw the spinach and wring as dry as possible in a kitchen towel. Put the butter and bacon into a large frying pan and saute until some of the fat is rendered. Add the onions and cook until pale golden. The bacon should not be crisp. Stir in the flour and milk cooking until thickened. Add nutmeg, rosemary, and beef stock base and blend well. Add the spinach and cook over medium heat for 5 minutes or so. Season to taste.",45,ounces,"frozen spinach, chopped",2,tbsp,butter,10,slices,"bacon, cut into 1/2 inch dice",2,large,"onions, chopped",2,tbsp,flour,1,cup,milk, 1/4,tsp,nutmeg,1,tsp,beef stock base or a boullion cube,nan,nan,nan,nan,nan,nan,nan,nan,nan,nan,nan,nan,nan,nan,nan,nan,nan,nan,nan,nan,nan,nan,nan,nan,nan,nan,nan,nan,nan,nan,nan,nan,nan,asian food,"frozen spinach, chopped;butter;bacon, cut into 1/2 inch dice;onions, chopped;flour;milk;nutmeg;beef stock base or a boullion cube;nan;nan;nan;nan;nan;nan;nan;nan;nan;nan;nan","['frozen', 'spinach', ',', 'chopped', ';', 'butter', ';', 'bacon', ',', 'cut', 'into', '1/2', 'inch', 'dice', ';', 'onions', ',', 'chopped', ';', 'flour', ';', 'milk', ';', 'nutmeg', ';', 'beef', 'stock', 'base', 'or', 'a', 'boullion', 'cube', ';', 'nan', ';', 'nan', ';', 'nan', ';', 'nan', ';', 'nan', ';', 'nan', ';', 'nan', ';', 'nan', ';', 'nan', ';', 'nan', ';', 'nan']","['milk', 'flour']"
Three Cheese Spinach,"Combine onions and mushrooms in small microwave-safe bowl. Microwave 1 to 3 minutes or until onions are soft. Place spinach in 1 1/2 quart microwave-safe casserole. Cover and microwave 6 to 9 minutes, breaking up and rearranging every 3 minutes, until defrosted. Drain well.Add onion mixture to spinach, along with cottage cheese, parmesan cheese, eggs, salt and pepper. Stir well to blend. Microwave, uncovered, 8 to 11 minutes, rotating dish if necessary every 3 minutes, until misture is headted through and set.Sprinkle grated cheese over top and dust lightly with paprika. Microwave about 1 minute longer to melt cheese. Let stand 3 minutes before serving.Yields 6 to 8 servings.", 1/2,medium,"onion, chopped",1,4 ounce can,"mushroom stems and pieces, drained",2,10 ounce package,frozen chopped spinach,2,cups,low fat cottage cheese, 1/3,cup,grated parmesan cheese,2,nan,"eggs, lightly beaten",nan,salt,nan,nan,pepper,nan, 1/3,cup,grated swiss cheese,nan,paprika,nan,nan,nan,nan,nan,nan,nan,nan,nan,nan,nan,nan,nan,nan,nan,nan,nan,nan,nan,nan,nan,nan,nan,nan,nan,nan,nan,nan,asian food,"onion, chopped;mushroom stems and pieces, drained;frozen chopped spinach;low fat cottage cheese;grated parmesan cheese;eggs, lightly beaten;nan;nan;grated swiss cheese;nan;nan;nan;nan;nan;nan;nan;nan;nan;nan","['onion', ',', 'chopped', ';', 'mushroom', 'stems', 'and', 'pieces', ',', 'drained', ';', 'frozen', 'chopped', 'spinach', ';', 'low', 'fat', 'cottage', 'cheese', ';', 'grated', 'parmesan', 'cheese', ';', 'eggs', ',', 'lightly', 'beaten', ';', 'nan', ';', 'nan', ';', 'grated', 'swiss', 'cheese', ';', 'nan', ';', 'nan', ';', 'nan', ';', 'nan', ';', 'nan', ';', 'nan', ';', 'nan', ';', 'nan', ';', 'nan', ';', 'nan']",['eggs']
Tulelake Potato Casserole,"Thaw potatoes. Mix first 8 ingredients. Put in 9"" x 13"" casserole dish. Top with cornflakes and melted butter mixture. Bake at 350 degrees for 50 minutes. Can be prepared ahead and frozen.",2,packages,"frozen hashbrown potatoes, thawed", 1/4,cup,"butter, melted",1,teaspoon,salt, 1/2,teaspoon,pepper,3,tablespoons,dried onions or 1/2 cup fresh,1,can,cream of chcken soup,2,cups,"cheddar cheese, grated",1 1/2,cups,sour cream, 1/4,cup,melted butter,2,cups,"cornflakes, crushed",nan,nan,nan,nan,nan,nan,nan,nan,nan,nan,nan,nan,nan,nan,nan,nan,nan,nan,nan,nan,nan,nan,nan,nan,nan,nan,nan,asian food,"frozen hashbrown potatoes, thawed;butter, melted;salt;pepper;dried onions or 1/2 cup fresh;cream of chcken soup;cheddar cheese, grated;sour cream;melted butter;cornflakes, crushed;nan;nan;nan;nan;nan;nan;nan;nan;nan","['frozen', 'hashbrown', 'potatoes', ',', 'thawed', ';', 'butter', ',', 'melted', ';', 'salt', ';', 'pepper', ';', 'dried', 'onions', 'or', '1/2', 'cup', 'fresh', ';', 'cream', 'of', 'chcken', 'soup', ';', 'cheddar', 'cheese', ',', 'grated', ';', 'sour', 'cream', ';', 'melted', 'butter', ';', 'cornflakes', ',', 'crushed', ';', 'nan', ';', 'nan', ';', 'nan', ';', 'nan', ';', 'nan', ';', 'nan', ';', 'nan', ';', 'nan', ';', 'nan']",[]
Zucchini Patties,"Courslet shred zucchini into a bowl. Press out water. Add rest of ingredients, except oil. Heat oil in skillet. Drop mixture by spoonfuls. Brown on both sides. May also be topped with spaghetti sauce.",5,medium,zucchini,3,nan,eggs,1,tablesoon,parmesan cheese,1,clove,garlic,2,tablespoons,flour, 1/2,cup,parsley, 1/2,cup,onion,1,teaspoon,salt, 1/2,teaspoon,pepper, 1/2,cup,olive oil,nan,nan,nan,nan,nan,nan,nan,nan,nan,nan,nan,nan,nan,nan,nan,nan,nan,nan,nan,nan,nan,nan,nan,nan,nan,nan,nan,asian food,zucchini;eggs;parmesan cheese;garlic;flour;parsley;onion;salt;pepper;olive oil;nan;nan;nan;nan;nan;nan;nan;nan;nan,"['zucchini', ';', 'eggs', ';', 'parmesan', 'cheese', ';', 'garlic', ';', 'flour', ';', 'parsley', ';', 'onion', ';', 'salt', ';', 'pepper', ';', 'olive', 'oil', ';', 'nan', ';', 'nan', ';', 'nan', ';', 'nan', ';', 'nan', ';', 'nan', ';', 'nan', ';', 'nan', ';', 'nan']","['flour', 'eggs']"
Apple Dumplings,"Make syrup from first 5 ingredients. Make crust - roll 1/4 inch thick. CUt in 5 inch squares. Put 4 pieces of apple on each. Sprinkle with additional sugar, cinnamon, and nutmeg. Dot with butter. Fold corners to center; pinch together. Place 1 inch apart in greased baking dish. Pour syrup on top. Bake 375 degrees for 35 minutes. Serve warm with cream. Makes 6.",2,cups,sugar,2,cups,water, 1/4,teaspoon,cinnamon, 1/2,teaspoon,nutmeg, 1/2,cup,"butter, melted",6,nan,"apples, peeled, cut in 1/4",2,cups,flour,1,teaspoon,salt,2,teaspoons,baking powder, 3/4,cup,shortening, 1/2,cup,milk,nan,nan,nan,nan,nan,nan,nan,nan,nan,nan,nan,nan,nan,nan,nan,nan,nan,nan,nan,nan,nan,nan,nan,nan,asian food,"sugar;water;cinnamon;nutmeg;butter, melted;apples, peeled, cut in 1/4;flour;salt;baking powder;shortening;milk;nan;nan;nan;nan;nan;nan;nan;nan","['sugar', ';', 'water', ';', 'cinnamon', ';', 'nutmeg', ';', 'butter', ',', 'melted', ';', 'apples', ',', 'peeled', ',', 'cut', 'in', '1/4', ';', 'flour', ';', 'salt', ';', 'baking', 'powder', ';', 'shortening', ';', 'milk', ';', 'nan', ';', 'nan', ';', 'nan', ';', 'nan', ';', 'nan', ';', 'nan', ';', 'nan', ';', 'nan']","['sugar', 'milk', 'flour', 'apples']"
Apple Dessert for a Crowd,"Combine flour, sugar, salt and shortening. Add egg/milk mixture to flour mixture using beater. Put 1/2 of mixture into a jelly roll pan. Reserve other 1/2 for the op. Sprinkle onto dough in pan; cornflakes, apples, sugar, and cinnamon. Cover with the other 1/2 of dough. Beat egg white until stiff, spread over crust.Bake at 400 degrees for about 40 minutes.Glaze with powdered sugar and hot water glaze while still warm. Would also be good in a smaller pan for a coffee cake strudel breakfast roll.",2 1/2,cups,flour,1,tablespoon,sugar,1,nan,salt,1,cup,shortening,1,nan,"egg yolk, plus enough milk to make 1/2 cup",1,cup,"cornflakes, crushed",1,cup,"cornflakes, crushed",5,cups,"tart apples, sliced",1 1/2,cups,sugar,1,teaspoon,cinnamon,nan,nan,nan,nan,nan,nan,nan,nan,nan,nan,nan,nan,nan,nan,nan,nan,nan,nan,nan,nan,nan,nan,nan,nan,nan,nan,nan,asian food,"flour;sugar;salt;shortening;egg yolk, plus enough milk to make 1/2 cup;cornflakes, crushed;cornflakes, crushed;tart apples, sliced;sugar;cinnamon;nan;nan;nan;nan;nan;nan;nan;nan;nan","['flour', ';', 'sugar', ';', 'salt', ';', 'shortening', ';', 'egg', 'yolk', ',', 'plus', 'enough', 'milk', 'to', 'make', '1/2', 'cup', ';', 'cornflakes', ',', 'crushed', ';', 'cornflakes', ',', 'crushed', ';', 'tart', 'apples', ',', 'sliced', ';', 'sugar', ';', 'cinnamon', ';', 'nan', ';', 'nan', ';', 'nan', ';', 'nan', ';', 'nan', ';', 'nan', ';', 'nan', ';', 'nan', ';', 'nan']","['sugar', 'milk', 'flour', 'apples']"
